text,labels,id,num_labels,char_len,word_len,label_names,text_clean_tfidf,text_clean_transformer,grouped_labels
"Godspeed and be well, [NAME].",[27],ee3acga,1,29,5,['neutral'],godspeed well name,"Godspeed and be well , [ NAME ] .",['neutral']
"Y'all just joking but I want to hear what they eat, and I want pictures too so [NAME] step your game up ","[1, 7]",ee0hqyi,2,104,22,"['amusement', 'curiosity']",joking want hear eat want pictures name step game,"Y'all just joking but I want to hear what they eat , and I want pictures too so [ NAME ] step your game up","['ambiguous', 'positive']"
I want him to change and realize he messed up and he needs to do better,"[5, 8, 22]",eedf0to,3,71,16,"['caring', 'desire', 'realization']",want change realize messed needs better,I want him to change and realize he messed up and he needs to do better,"['ambiguous', 'positive']"
"Please get your soy away from me, i’m allergic.","[3, 11]",eeag5w2,2,47,9,"['annoyance', 'disgust']",please get soy away allergic,"Please get your soy away from me , i ’ m allergic .",['negative']
"What an incredibly well thought out response, totally related to the character and moves that were previously being discussed",[27],edf3pon,1,125,19,['neutral'],incredibly well thought response totally related character moves previously discussed,"What an incredibly well thought out response , totally related to the character and moves that were previously being discussed",['neutral']
I'd give it a 9/10 one of my favorites. So what was your thoughts on D'jango?,"[0, 7]",eewgb7s,2,77,16,"['admiration', 'curiosity']",give one favorites thoughts,I 'd give it a 9/10 one of my favorites . So what was your thoughts on D'jango ?,"['ambiguous', 'positive']"
"I love everything I have ever made in mine, but recently it's mostly used to hard boil eggs.",[18],ednbyl9,1,92,18,['love'],love everything ever made mine recently mostly used hard boil eggs,"I love everything I have ever made in mine , but recently it 's mostly used to hard boil eggs .",['positive']
"You're thinking of the mirror universe from Star Trek, not [NAME]. Easy mistake to make, I guess.",[27],ed343cu,1,97,17,['neutral'],thinking mirror universe star trek name easy mistake make guess,"You 're thinking of the mirror universe from Star Trek , not [ NAME ] . Easy mistake to make , I guess .",['neutral']
What a disgusting person she is,[11],eelh48j,1,31,6,['disgust'],disgusting person,What a disgusting person she is,['negative']
"Nice, Butt Stallion just chilling in the background","[0, 17]",ed4cjqt,2,51,8,"['admiration', 'joy']",nice butt stallion chilling background,"Nice , Butt Stallion just chilling in the background",['positive']
Kabhi Khushi kabhi gam? Slightly different but raichands were rich and mother was doing pooja.,[4],ednrypp,1,94,15,['approval'],kabhi khushi kabhi gam slightly different raichands rich mother pooja,Kabhi Khushi kabhi gam ? Slightly different but raichands were rich and mother was doing pooja .,['positive']
"Literally shaking, I hope you're getting the support you need with the ptsd this has obviously caused.",[20],edt4r0l,1,102,17,['optimism'],literally shaking hope getting support need ptsd obviously caused,"Literally shaking , I hope you 're getting the support you need with the ptsd this has obviously caused .",['positive']
Hello! how’s it going?,[27],ed0tfww,1,22,4,['neutral'],hello going,Hello ! how ’ s it going ?,['neutral']
"Sure, let's kill a guy with a buck on his horse because that's how it was in the old west. Smh",[4],edgxomn,1,94,21,['approval'],sure let kill guy buck horse old west smh,"Sure , let 's kill a guy with a buck on his horse because that 's how it was in the old west . Smh",['positive']
Thank you. Language is weird. Why do you have multiple words for the same thing?,[15],eeihmkq,1,80,15,['gratitude'],thank language weird multiple words thing,Thank you . Language is weird . Why do you have multiple words for the same thing ?,['positive']
Oh jeez. Just look at her eyes compared to the other girls.,[27],eddje9v,1,59,12,['neutral'],oh jeez look eyes compared girls,Oh jeez . Just look at her eyes compared to the other girls .,['neutral']
Just do it... Do her I mean... Get it over and done with.,[27],eetw30p,1,57,13,['neutral'],mean get done,Just do it ... Do her I mean ... Get it over and done with .,['neutral']
Oh I missed that part. So the cheeky poster was referring to that crash. ;0,[26],eed7qdu,1,75,15,['surprise'],oh missed part cheeky poster referring crash 0,Oh I missed that part . So the cheeky poster was referring to that crash . ; 0,['ambiguous']
Absolutely! The Republicans are craven,[4],ee7ubq4,1,38,5,['approval'],absolutely republicans craven,Absolutely ! The Republicans are craven,['positive']
"The castle, assuming it's properly furnished and comes with servants to run the place.",[27],eehictk,1,86,14,['neutral'],castle assuming properly furnished comes servants run place,"The castle , assuming it 's properly furnished and comes with servants to run the place .",['neutral']
Thank you for this! :),[15],ee9eb9v,1,22,5,['gratitude'],thank,Thank you for this ! : ),['positive']
Why is the hotdog so long lmao,[7],eee8ttt,1,30,7,['curiosity'],hotdog long lmao,Why is the hotdog so long lmao,['ambiguous']
Doing the bus story would be interesting-- perhaps interviewing some drivers who have encountered a ghost.,[27],eeu99vo,1,106,16,['neutral'],bus story would interesting perhaps interviewing drivers encountered ghost,Doing the bus story would be interesting -- perhaps interviewing some drivers who have encountered a ghost .,['neutral']
"Sorry to hear that, I hope you're doing better now.",[24],eebrnth,1,51,10,['remorse'],sorry hear hope better,"Sorry to hear that , I hope you 're doing better now .",['negative']
People who mindlessly defend Turkey and Ergodan are very delusional!,"[25, 27]",eeol28d,2,68,10,"['sadness', 'neutral']",people mindlessly defend turkey ergodan delusional,People who mindlessly defend Turkey and Ergodan are very delusional !,"['negative', 'neutral']"
Future is bright to me!,[20],eeb11v0,1,23,5,['optimism'],future bright,Future is bright to me !,['positive']
"Yeah, that’s what I meant. My bad.",[4],ee06wf9,1,34,7,['approval'],yeah meant bad,"Yeah , that ’ s what I meant . My bad .",['positive']
Yep. I’ve done a couple shoots at Hornsby small bore and one clay pidgeon day at Lucas Heights.,[4],eehe2wb,1,95,18,['approval'],yep done couple shoots hornsby small bore one clay pidgeon day lucas heights,Yep . I ’ ve done a couple shoots at Hornsby small bore and one clay pidgeon day at Lucas Heights .,['positive']
Pharmacy residencies started that in 2017 and honestly it makes the process so much better for both candidates and applicants.,[4],eemnj8a,1,126,20,['approval'],pharmacy residencies started 2017 honestly makes process much better candidates applicants,Pharmacy residencies started that in 2017 and honestly it makes the process so much better for both candidates and applicants .,['positive']
My nuts hurt watching that second part,[25],eevgxuk,1,38,7,['sadness'],nuts hurt watching second part,My nuts hurt watching that second part,['negative']
Opinion is just that: subjective. I'm sorry you're too fragile about your own to have reasonable discussion with those that disagree.,[27],ee7t7de,1,133,21,['neutral'],opinion subjective sorry fragile reasonable discussion disagree,Opinion is just that : subjective . I 'm sorry you 're too fragile about your own to have reasonable discussion with those that disagree .,['neutral']
Never noticed how unsettling palpatine looked,[22],eexwzir,1,45,6,['realization'],never noticed unsettling palpatine looked,Never noticed how unsettling palpatine looked,['ambiguous']
Mate imagine reacting so poorly to be called out to calling anyone who has been discussing ozil and sven unreasonable.,[9],eebu1t2,1,118,20,['disappointment'],mate imagine reacting poorly called calling anyone discussing ozil sven unreasonable,Mate imagine reacting so poorly to be called out to calling anyone who has been discussing ozil and sven unreasonable .,['negative']
Jokes on you I have one of those fancy electric toothbrush stands!,[1],eey45td,1,66,12,['amusement'],jokes one fancy electric toothbrush stands,Jokes on you I have one of those fancy electric toothbrush stands !,['positive']
"Agreed, rarely get mad at ones like hun or darl. Being called boy by an old man however is infuriating.",[2],eeyjd7m,1,103,20,['anger'],agreed rarely get mad ones like hun darl called boy old man however infuriating,"Agreed , rarely get mad at ones like hun or darl . Being called boy by an old man however is infuriating .",['negative']
That's ruis intentions,[27],efdwpqk,1,22,3,['neutral'],ruis intentions,That 's ruis intentions,['neutral']
Not available in my country. Can't believe this has to be a thing in the modern age.,[26],efh30uw,1,84,17,['surprise'],available country ca believe thing modern age,Not available in my country . Ca n't believe this has to be a thing in the modern age .,['ambiguous']
it's a good thing they had a screen protector on it,[0],eelf1ah,1,51,11,['admiration'],good thing screen protector,it 's a good thing they had a screen protector on it,['positive']
"Pretty terrifying. Imagine if you went on a school trip, did nothing, and came home to this.",[14],eeqf2j8,1,92,17,['fear'],pretty terrifying imagine went school trip nothing came home,"Pretty terrifying . Imagine if you went on a school trip , did nothing , and came home to this .",['negative']
Everyone else's obsession sounds useful... I get obsessed with certain actors.,[4],edxosgh,1,78,11,['approval'],everyone else obsession sounds useful get obsessed certain actors,Everyone else 's obsession sounds useful ... I get obsessed with certain actors .,['positive']
"Then they're the worst fascists of all time, because their critics have been extremely loud and public, while not being murdered.","[2, 11]",ee5dvj7,2,129,21,"['anger', 'disgust']",worst fascists time critics extremely loud public murdered,"Then they 're the worst fascists of all time , because their critics have been extremely loud and public , while not being murdered .",['negative']
"Also how nonchalantly he hits them, like he's swatting a mildly irritating fly",[27],efa020j,1,78,13,['neutral'],also nonchalantly hits like swatting mildly irritating fly,"Also how nonchalantly he hits them , like he 's swatting a mildly irritating fly",['neutral']
Congrats dude! I hope my shitstuation turns around as greatly as yours did.,[15],ed57na9,1,75,13,['gratitude'],congrats dude hope shitstuation turns around greatly,Congrats dude ! I hope my shitstuation turns around as greatly as yours did .,['positive']
I like that he keeps with the Cardinals’ colors. This needs to be an alternative uniform,[18],ef8kjbs,1,88,16,['love'],like keeps cardinals colors needs alternative uniform,I like that he keeps with the Cardinals ’ colors . This needs to be an alternative uniform,['positive']
they just dropped KAP45. Free for 2 amazing guns but a pistol costs money? What gives.,[7],eephj7r,1,86,16,['curiosity'],dropped kap45 free 2 amazing guns pistol costs money gives,they just dropped KAP45 . Free for 2 amazing guns but a pistol costs money ? What gives .,['ambiguous']
Yes. They don't care about the will of the people anyway.,[27],ef6sb75,1,57,11,['neutral'],yes care people anyway,Yes . They do n't care about the will of the people anyway .,['neutral']
That [NAME] missed layup is haunting me right now.,[14],edy5han,1,50,9,['fear'],name missed layup haunting right,That [ NAME ] missed layup is haunting me right now .,['negative']
They were on the losing side of WW2 and unconditionally surrendered.,[27],ee9qlgi,1,68,11,['neutral'],losing side ww2 unconditionally surrendered,They were on the losing side of WW2 and unconditionally surrendered .,['neutral']
He’s legally blind... medical marijuana is a thing bro... got any on ya?,[7],edcrstd,1,72,13,['curiosity'],legally blind medical marijuana thing bro got ya,He ’ s legally blind ... medical marijuana is a thing bro ... got any on ya ?,['ambiguous']
I skipped the Oilers game for a birthday party for a cat. I’m glad I did that instead.,[17],eeng1ku,1,86,18,['joy'],skipped oilers game birthday party cat glad instead,I skipped the Oilers game for a birthday party for a cat . I ’ m glad I did that instead .,['positive']
"I got the feeling too. It's possible, or the ground is just rough. ",[4],eegqz8g,1,67,13,['approval'],got feeling possible ground rough,"I got the feeling too . It 's possible , or the ground is just rough .",['positive']
"Other than some wacky pick up orders, the dine-in customers are very sweet at my place. It’s a good thing :)",[17],eeuoqxz,1,108,21,['joy'],wacky pick orders customers sweet place good thing,"Other than some wacky pick up orders , the dine-in customers are very sweet at my place . It ’ s a good thing : )",['positive']
HAHAHAHA!!!!!,[1],efd9gsy,1,13,1,['amusement'],hahahaha,HAHAHAHA ! ! ! ! !,['positive']
That is really awesome you found something like that for him. Have a great time.,[0],edknayq,1,80,15,['admiration'],really awesome found something like great time,That is really awesome you found something like that for him . Have a great time .,['positive']
My condolences.,[25],eex7ti7,1,15,2,['sadness'],condolences,My condolences .,['negative']
"Ask them if they’re going to give you a “test salary” for it... if not, nope out of there. ",[27],eeaaw62,1,91,19,['neutral'],ask going give test salary nope,"Ask them if they ’ re going to give you a “ test salary ” for it ... if not , nope out of there .",['neutral']
No need to bully me.,[3],eeqpiu3,1,20,5,['annoyance'],need bully,No need to bully me .,['negative']
I also relate (and regret),[24],ef7btjf,1,26,5,['remorse'],also relate regret,I also relate ( and regret ),['negative']
" Luckily from him, there is no death penalty in Brazil and the maximum a person can serve in a Brazilian jail is 20 consecutive years. ",[27],ef3c530,1,135,25,['neutral'],luckily death penalty brazil maximum person serve brazilian jail 20 consecutive years,"Luckily from him , there is no death penalty in Brazil and the maximum a person can serve in a Brazilian jail is 20 consecutive years .",['neutral']
Thats insane. Someone died like 2 years ago after a bolt got kicked up by a truck and went through his windshield and hit him on 146 in LaPorte,[16],edy9n76,1,143,29,['grief'],thats insane someone died like 2 years ago bolt got kicked truck went windshield hit 146 laporte,Thats insane . Someone died like 2 years ago after a bolt got kicked up by a truck and went through his windshield and hit him on 146 in LaPorte,['negative']
he didnt miss that,[27],eecin0z,1,18,4,['neutral'],didnt miss,he didnt miss that,['neutral']
"Or a ""what if"" episode where [NAME] and [NAME] didn't die!","[6, 7]",ed9rrmq,2,58,11,"['confusion', 'curiosity']",episode name name die,Or a `` what if '' episode where [ NAME ] and [ NAME ] did n't die !,['ambiguous']
"Very tired us can attendant: ""here are your vagina slimes."" ... thankfully the customer just laughed kt off.","[15, 17]",efe75rh,2,108,18,"['gratitude', 'joy']",tired us attendant vagina slimes thankfully customer laughed kt,Very tired us can attendant : `` here are your vagina slimes . '' ... thankfully the customer just laughed kt off .,['positive']
"The opposition need to come together, for the meanwhile, and put their differences aside and attack the real enemy, not each other. ",[22],ee7wguu,1,132,22,['realization'],opposition need come together meanwhile put differences aside attack real enemy,"The opposition need to come together , for the meanwhile , and put their differences aside and attack the real enemy , not each other .",['ambiguous']
>complain that government can't do anything right >get elected and prove it,[27],ed32dm2,1,75,12,['neutral'],complain government ca anything right get elected prove,> complain that government ca n't do anything right > get elected and prove it,['neutral']
Not a Fan if anything FFXiii but I loved this game. Hope we get a season 2.,"[0, 20]",ef6kmd1,2,75,17,"['admiration', 'optimism']",fan anything ffxiii loved game hope get season 2,Not a Fan if anything FFXiii but I loved this game . Hope we get a season 2 .,['positive']
“Dear [NAME] you Coach [NAME]?,"[7, 27]",edv5uzt,2,30,5,"['curiosity', 'neutral']",dear name coach name,“ Dear [ NAME ] you Coach [ NAME ] ?,"['ambiguous', 'neutral']"
Thank you! I had no idea Reddit had profile pictures and I've been using for a couple of years.,[15],ed4hcsi,1,95,19,['gratitude'],thank idea reddit profile pictures using couple years,Thank you ! I had no idea Reddit had profile pictures and I 've been using for a couple of years .,['positive']
I want to be a rapper. I also like to write poetry and stuff. So to be successful with those things also I want to design clothing.,"[8, 20]",efgqrun,2,131,27,"['desire', 'optimism']",want rapper also like write poetry stuff successful things also want design clothing,I want to be a rapper . I also like to write poetry and stuff . So to be successful with those things also I want to design clothing .,['positive']
Not just that. Falling oil prices really hit Iran very hard (and is about to hit Iraq's next year budget hard next year as well).,[20],ed9k851,1,129,25,['optimism'],falling oil prices really hit iran hard hit iraq next year budget hard next year well,Not just that . Falling oil prices really hit Iran very hard ( and is about to hit Iraq 's next year budget hard next year as well ) .,['positive']
Pres named his business barstool. The expectation of stupidity is the brand.,[27],ee2s7au,1,76,12,['neutral'],pres named business barstool expectation stupidity brand,Pres named his business barstool . The expectation of stupidity is the brand .,['neutral']
You should have started to tickle his feet,[27],ef0n7y4,1,42,8,['neutral'],started tickle feet,You should have started to tickle his feet,['neutral']
"Thanks, you’re right. I should delete the app. ","[4, 15]",ef7xmmt,2,47,8,"['approval', 'gratitude']",thanks right delete app,"Thanks , you ’ re right . I should delete the app .",['positive']
Cognitive Dissonance. Big problem in our society.,[9],eegk5xm,1,49,7,['disappointment'],cognitive dissonance big problem society,Cognitive Dissonance . Big problem in our society .,['negative']
I am from central pennsylvania and moved to AZ. Phoenix definitely has the nicest expressways in the country.,[0],eeh4rik,1,109,18,['admiration'],central pennsylvania moved az phoenix definitely nicest expressways country,I am from central pennsylvania and moved to AZ . Phoenix definitely has the nicest expressways in the country .,['positive']
"They spoofed their number, unfortunately (you know, time travel rules and all). Also: > older ~~then~~ my joke. than* :D",[27],educoe4,1,120,20,['neutral'],spoofed number unfortunately know time travel rules also older joke,"They spoofed their number , unfortunately ( you know , time travel rules and all ) . Also : > older ~~then~~ my joke . than * : D",['neutral']
This really is matter of principle. Its small now and it would only encourave him to take more next time.,[27],eel15i5,1,105,20,['neutral'],really matter principle small would encourave take next time,This really is matter of principle . Its small now and it would only encourave him to take more next time .,['neutral']
"Get in, I'll tune in now",[4],efbv1xt,1,24,6,['approval'],get tune,"Get in , I 'll tune in now",['positive']
Imagine insulting your wife and father then you carry water for the same person. [NAME] is a basic....,[27],eew42hz,1,102,18,['neutral'],imagine insulting wife father carry water person name basic,Imagine insulting your wife and father then you carry water for the same person . [ NAME ] is a basic ....,['neutral']
I turned the news on around 6 this morning and have never been so happy to have a commute of 4 miles to my job,[17],eemapl9,1,110,25,['joy'],turned news around 6 morning never happy commute 4 miles job,I turned the news on around 6 this morning and have never been so happy to have a commute of 4 miles to my job,['positive']
I'm not even surecwhat it is why do people hate it?,[6],ed2v1mt,1,51,11,['confusion'],even surecwhat people hate,I 'm not even surecwhat it is why do people hate it ?,['ambiguous']
"> But, President [NAME] can just hand out pardons for anything federal. Presidential pardons don't affect impeachments.",[27],eeqp23w,1,119,17,['neutral'],president name hand pardons anything federal presidential pardons affect impeachments,"> But , President [ NAME ] can just hand out pardons for anything federal . Presidential pardons do n't affect impeachments .",['neutral']
Yeah I don't think [NAME] even had to move his hands for that one. [NAME] and [NAME] also destroyed the precision QB challenge too.,"[3, 10]",eewh4x6,2,131,24,"['annoyance', 'disapproval']",yeah think name even move hands one name name also destroyed precision qb challenge,Yeah I do n't think [ NAME ] even had to move his hands for that one . [ NAME ] and [ NAME ] also destroyed the precision QB challenge too .,['negative']
"Not sure, what organization? How deep are you certified for? Most shops are PADI, but you can cross over easily.",[6],edl0wca,1,112,20,['confusion'],sure organization deep certified shops padi cross easily,"Not sure , what organization ? How deep are you certified for ? Most shops are PADI , but you can cross over easily .",['ambiguous']
"salarians don't have marriage, that's probably on account of their short lifespans. ",[27],eem31cr,1,84,12,['neutral'],salarians marriage probably account short lifespans,"salarians do n't have marriage , that 's probably on account of their short lifespans .",['neutral']
"Grew up in an early 90's house with door handles, no knobs. My parents just switched to knobs after 25 years.",[27],eeanqlt,1,109,21,['neutral'],grew early 90 house door handles knobs parents switched knobs 25 years,"Grew up in an early 90 's house with door handles , no knobs . My parents just switched to knobs after 25 years .",['neutral']
Real Person. I'm just saying I like the merchandise.,"[4, 18]",edxfw8k,2,52,9,"['approval', 'love']",real person saying like merchandise,Real Person . I 'm just saying I like the merchandise .,['positive']
And queuing up to rewatch that series,[27],ee7kq20,1,37,7,['neutral'],queuing rewatch series,And queuing up to rewatch that series,['neutral']
"That is so sad, just goes to show we have a lot more to learn about the other beings we share this rock with : /",[25],efdxxjo,1,112,26,['sadness'],sad goes show lot learn beings share rock,"That is so sad , just goes to show we have a lot more to learn about the other beings we share this rock with : /",['negative']
That’s Grandpa [NAME]. I stomp flaming bags with my boots,[2],ed8dyzo,1,57,10,['anger'],grandpa name stomp flaming bags boots,That ’ s Grandpa [ NAME ] . I stomp flaming bags with my boots,['negative']
My fav character,[18],edj2mi3,1,16,3,['love'],fav character,My fav character,['positive']
Thank u goalie [NAME],[15],eeejjy9,1,21,4,['gratitude'],thank u goalie name,Thank u goalie [ NAME ],['positive']
At least it made for hilarious responses by people being aghast by the price.,[1],ef60cbz,1,77,14,['amusement'],least made hilarious responses people aghast price,At least it made for hilarious responses by people being aghast by the price .,['positive']
"I guess. I'm going to try getting in better shape, and just socialize more.",[20],edefxih,1,75,14,['optimism'],guess going try getting better shape socialize,"I guess . I 'm going to try getting in better shape , and just socialize more .",['positive']
"I was so hyped after the zach shot, I'm still crying ",[25],ed9x7dz,1,53,11,['sadness'],hyped zach shot still crying,"I was so hyped after the zach shot , I 'm still crying",['negative']
I wish it were. It would be funny to imply that [NAME] won [NAME] shirt!,[8],ee8zx2p,1,72,15,['desire'],wish would funny imply name name shirt,I wish it were . It would be funny to imply that [ NAME ] won [ NAME ] shirt !,['positive']
Old toothless finally coming out of his den?,[27],ef01ypk,1,44,8,['neutral'],old toothless finally coming den,Old toothless finally coming out of his den ?,['neutral']
Yeah I'm a moderator there. I'll let you post anything there because I'm a nice mod.,[4],eedohba,1,84,16,['approval'],yeah moderator let post anything nice mod,Yeah I 'm a moderator there . I 'll let you post anything there because I 'm a nice mod .,['positive']
Spicy water.,[27],ediqha5,1,12,2,['neutral'],spicy water,Spicy water .,['neutral']
"""They mostly vote at night... mostly.""",[27],effmea5,1,38,6,['neutral'],mostly vote night mostly,`` They mostly vote at night ... mostly . '',['neutral']
Boiled peanuts are my happy food.,[17],edeelro,1,33,6,['joy'],boiled peanuts happy food,Boiled peanuts are my happy food .,['positive']
Aw crap you're right. Sorry I suck at names and shit,[24],eda96vx,1,52,11,['remorse'],aw crap right sorry suck names shit,Aw crap you 're right . Sorry I suck at names and shit,['negative']
"The moment that bird touches my xbox, it'll become a mcnugget. ",[27],eejkt5m,1,63,11,['neutral'],moment bird touches xbox become mcnugget,"The moment that bird touches my xbox , it 'll become a mcnugget .",['neutral']
"omg you got me, what do i do now, pls help",[13],efgzole,1,42,11,['excitement'],omg got pls help,"omg you got me , what do i do now , pls help",['positive']
I laughed so hard.,[1],ef8fdtx,1,18,4,['amusement'],laughed hard,I laughed so hard .,['positive']
