text,labels,id,num_labels,char_len,word_len,label_names,text_clean_tfidf,text_clean_transformer,grouped_labels
That'd be amazing! Heard about Newington's reno not long ago. Need to get over there.,[0],eel2edy,1,85,15,['admiration'],amazing heard newington reno long ago need get,That 'd be amazing ! Heard about Newington 's reno not long ago . Need to get over there .,['positive']
De un tronco a otro. I hope they wake up!,[20],eetdm2z,1,41,10,['optimism'],de un tronco otro hope wake,De un tronco a otro . I hope they wake up !,['positive']
I love it that they're filming this with a phone or something,[18],efdeavl,1,61,12,['love'],love filming phone something,I love it that they 're filming this with a phone or something,['positive']
"Lucky, when I did it my nickname ended up being [NAME]",[17],ed2jgez,1,54,11,['joy'],lucky nickname ended name,"Lucky , when I did it my nickname ended up being [ NAME ]",['positive']
Breaking bad all over again,[9],ed7ltuk,1,27,5,['disappointment'],breaking bad,Breaking bad all over again,['negative']
"I really hope you won't have the chance to enjoy them because man, I didn't like them anything :)",[10],eddjtj0,1,97,19,['disapproval'],really hope wo chance enjoy man like anything,"I really hope you wo n't have the chance to enjoy them because man , I did n't like them anything : )",['negative']
oh Ye crazy again for 2019 huh,[13],ed20fjc,1,30,7,['excitement'],oh ye crazy 2019 huh,oh Ye crazy again for 2019 huh,['positive']
"I never had a problem with the old parachuting mechanic, but I like the new one and I think it might actually be better.",[18],efeb2of,1,120,24,['love'],never problem old parachuting mechanic like new one think might actually better,"I never had a problem with the old parachuting mechanic , but I like the new one and I think it might actually be better .",['positive']
"You're right, there is mongos in every support. That doesn't mean you shouldn't call it out when you see it",[27],ef3yh7v,1,107,20,['neutral'],right mongos every support mean call see,"You 're right , there is mongos in every support . That does n't mean you should n't call it out when you see it",['neutral']
That is amazing! Congratulations! Such a great news!,"[0, 15]",ed906jd,2,52,8,"['admiration', 'gratitude']",amazing congratulations great news,That is amazing ! Congratulations ! Such a great news !,['positive']
Absolutely! The Republicans are craven,[4],ee7ubq4,1,38,5,['approval'],absolutely republicans craven,Absolutely ! The Republicans are craven,['positive']
what level of bloom would you think is appropriate?,[7],eedz0yb,1,51,9,['curiosity'],level bloom would think appropriate,what level of bloom would you think is appropriate ?,['ambiguous']
But the seriousness makes it funnier. YES HELLO 311? SOMEONE IS WRONG ON THE INTERNET.,[1],eevvxk8,1,86,15,['amusement'],seriousness makes funnier yes hello 311 someone wrong internet,But the seriousness makes it funnier . YES HELLO 311 ? SOMEONE IS WRONG ON THE INTERNET .,['positive']
I get that but there may be some folks out there that aren’t like that. Any help would be much appreciated.,[0],efbh2l9,1,107,21,['admiration'],get may folks like help would much appreciated,I get that but there may be some folks out there that aren ’ t like that . Any help would be much appreciated .,['positive']
Reckon she'd have your back too OP!,[27],edp779o,1,35,7,['neutral'],reckon back op,Reckon she 'd have your back too OP !,['neutral']
I drool over Elijah woods,[27],edihr0p,1,25,5,['neutral'],drool elijah woods,I drool over Elijah woods,['neutral']
Thanks I needed that.,[15],eef9xid,1,21,4,['gratitude'],thanks needed,Thanks I needed that .,['positive']
"What the problem? I mean, steak? Good. Doughnuts? Good!! I don’t see an issue. ","[7, 10]",eeikkk8,2,79,14,"['curiosity', 'disapproval']",problem mean steak good doughnuts good see issue,"What the problem ? I mean , steak ? Good . Doughnuts ? Good ! ! I don ’ t see an issue .","['ambiguous', 'negative']"
Ex Novo has a great one on their menu and probably open.,[0],ef85xv7,1,56,12,['admiration'],ex novo great one menu probably open,Ex Novo has a great one on their menu and probably open .,['positive']
That is one of the things I’m most excited for in S2. Seeing him playing [NAME] and go off like this so effortlessly is amazing,[13],ee5y25t,1,127,25,['excitement'],one things excited s2 seeing playing name go like effortlessly amazing,That is one of the things I ’ m most excited for in S2 . Seeing him playing [ NAME ] and go off like this so effortlessly is amazing,['positive']
It's irrelevant though. it doesn't need to be specified in the title of a post.,[10],eetjwdz,1,79,15,['disapproval'],irrelevant though need specified title post,It 's irrelevant though . it does n't need to be specified in the title of a post .,['negative']
Awesome! Glad you found it informative! Thanks for watching.,"[0, 15, 17]",eebippy,3,60,9,"['admiration', 'gratitude', 'joy']",awesome glad found informative thanks watching,Awesome ! Glad you found it informative ! Thanks for watching .,['positive']
This should be of interest to you. -,[27],edsmege,1,36,8,['neutral'],interest,This should be of interest to you . -,['neutral']
That was juicy.,[27],edc2xru,1,15,3,['neutral'],juicy,That was juicy .,['neutral']
I hope you stay as warm and safe as you can ❄💙,[20],efc4ioz,1,46,12,['optimism'],hope stay warm safe,I hope you stay as warm and safe as you can ❄💙,['positive']
"Thanks, we were just waiting for you to come in with the final say.",[15],edbjdkp,1,67,14,['gratitude'],thanks waiting come final say,"Thanks , we were just waiting for you to come in with the final say .",['positive']
"I really like this OP, going to start doing something similar - thank you! ",[15],eex5j03,1,75,14,['gratitude'],really like op going start something similar thank,"I really like this OP , going to start doing something similar - thank you !",['positive']
"Careful, it's hot ",[5],ed17kef,1,18,3,['caring'],careful hot,"Careful , it 's hot",['positive']
"I never believe draft rumors of who teams are looking at or wanting, especially if its fan rumors. ",[10],ed5kia8,1,99,18,['disapproval'],never believe draft rumors teams looking wanting especially fan rumors,"I never believe draft rumors of who teams are looking at or wanting , especially if its fan rumors .",['negative']
"It makes sense, just don't expect much thanks from the rest of them.",[15],eewhbtu,1,68,13,['gratitude'],makes sense expect much thanks rest,"It makes sense , just do n't expect much thanks from the rest of them .",['positive']
Please don't.,[10],ee6k26o,1,13,2,['disapproval'],please,Please do n't .,['negative']
"Also, here's the Mash Kyrielight Trailer:",[27],efh390k,1,41,6,['neutral'],also mash kyrielight trailer,"Also , here 's the Mash Kyrielight Trailer :",['neutral']
No! but they seem awesome!,[0],ed2shn2,1,26,5,['admiration'],seem awesome,No ! but they seem awesome !,['positive']
... and no one seemed to care Except that lonely woman with white hair,[25],eeq0z98,1,70,14,['sadness'],one seemed care except lonely woman white hair,... and no one seemed to care Except that lonely woman with white hair,['negative']
People still expecting that are delusional regardless tbh. Messed up they'll never say what happened to Half Life but time to start using some context clues herr,[22],edzmlum,1,161,27,['realization'],people still expecting delusional regardless tbh messed never say happened half life time start using context clues herr,People still expecting that are delusional regardless tbh . Messed up they 'll never say what happened to Half Life but time to start using some context clues herr,['ambiguous']
we're getting our top men right on that.,[27],edzqqkb,1,40,8,['neutral'],getting top men right,we 're getting our top men right on that .,['neutral']
Why? He was always brilliant. It was such a shame he lost out to [NAME]. Things would have been very different today...,[9],edxerwb,1,119,22,['disappointment'],always brilliant shame lost name things would different today,Why ? He was always brilliant . It was such a shame he lost out to [ NAME ] . Things would have been very different today ...,['negative']
"Last time, on Arrested Development...",[27],ed3i263,1,37,5,['neutral'],last time arrested development,"Last time , on Arrested Development ...",['neutral']
"I’m sure losing obj will help [NAME] get out of his slump, or help develop whichever rookie qb they bring in. ",[4],ed15m6m,1,110,21,['approval'],sure losing obj help name get slump help develop whichever rookie qb bring,"I ’ m sure losing obj will help [ NAME ] get out of his slump , or help develop whichever rookie qb they bring in .",['positive']
And I like the taste,[18],ef86ie7,1,20,5,['love'],like taste,And I like the taste,['positive']
I want my fucking cake back.,"[2, 3]",edpt7ey,2,28,6,"['anger', 'annoyance']",want fucking cake back,I want my fucking cake back .,['negative']
"Wait until they find his bastard son, [NAME]. Birthed by his mistress, [NAME].",[27],ef7w8bo,1,78,13,['neutral'],wait find bastard son name birthed mistress name,"Wait until they find his bastard son , [ NAME ] . Birthed by his mistress , [ NAME ] .",['neutral']
You have to try really hard to get banned on this sub.,[5],eepg3ia,1,54,12,['caring'],try really hard get banned sub,You have to try really hard to get banned on this sub .,['positive']
This is a school announcement: Remember not to commit thought crimes in the classroom. Repeated thought crimes will result in a lowering of your grades.,[27],eebcy4f,1,152,25,['neutral'],school announcement remember commit thought crimes classroom repeated thought crimes result lowering grades,This is a school announcement : Remember not to commit thought crimes in the classroom . Repeated thought crimes will result in a lowering of your grades .,['neutral']
"I do, and I've experienced a similar situation falling asleep. Like my mind is fixated on an object that keeps getting bigger and bigger.",[27],eevyhyl,1,137,24,['neutral'],experienced similar situation falling asleep like mind fixated object keeps getting bigger bigger,"I do , and I 've experienced a similar situation falling asleep . Like my mind is fixated on an object that keeps getting bigger and bigger .",['neutral']
"anarchist, bad branding word, many people like freedom but ""anarchy"" is associated with lawless chaotic bomb throwing",[27],efa2amd,1,117,17,['neutral'],anarchist bad branding word many people like freedom anarchy associated lawless chaotic bomb throwing,"anarchist , bad branding word , many people like freedom but `` anarchy '' is associated with lawless chaotic bomb throwing",['neutral']
Leave voice and text chats pls. Trash can.,[27],edyvr0s,1,42,8,['neutral'],leave voice text chats pls trash,Leave voice and text chats pls . Trash can .,['neutral']
Wait what happened??,[27],eeale5p,1,20,3,['neutral'],wait happened,Wait what happened ? ?,['neutral']
"I just saw the same, apparently she upheld her views in a 2016 interview. ",[27],edxrrce,1,74,14,['neutral'],saw apparently upheld views 2016 interview,"I just saw the same , apparently she upheld her views in a 2016 interview .",['neutral']
I take showers at night and I desperately need one atm. My hair has been really greasy recently.,[8],edmxkyn,1,96,18,['desire'],take showers night desperately need one atm hair really greasy recently,I take showers at night and I desperately need one atm . My hair has been really greasy recently .,['positive']
"Awesome, thanks. Great answer.","[0, 15]",efbxv1j,2,30,4,"['admiration', 'gratitude']",awesome thanks great answer,"Awesome , thanks . Great answer .",['positive']
"[NAME] bless you, fellow [NAME]! What a wonderful testimony of the changes that [NAME] can make in us. ","[0, 20]",efeddwq,2,103,18,"['admiration', 'optimism']",name bless fellow name wonderful testimony changes name make us,"[ NAME ] bless you , fellow [ NAME ] ! What a wonderful testimony of the changes that [ NAME ] can make in us .",['positive']
This comment completly proves the opinion of the OP right lmao. I’m so sorry America doesn’t meet your standards oh mighty reddit commentor,[24],ee0famc,1,139,23,['remorse'],comment completly proves opinion op right lmao sorry america meet standards oh mighty reddit commentor,This comment completly proves the opinion of the OP right lmao . I ’ m so sorry America doesn ’ t meet your standards oh mighty reddit commentor,['negative']
The world needs more [NAME]!,[27],ede8rlk,1,28,5,['neutral'],world needs name,The world needs more [ NAME ] !,['neutral']
Taking a blood thinner such as aspirin would keep it from clotting,[4],eej2zzb,1,66,12,['approval'],taking blood thinner aspirin would keep clotting,Taking a blood thinner such as aspirin would keep it from clotting,['positive']
"I got the unblinking eye, the one with the ribs in the dead eye slot, and the one with the hat takes a headshot",[27],ee6euz8,1,111,24,['neutral'],got unblinking eye one ribs dead eye slot one hat takes headshot,"I got the unblinking eye , the one with the ribs in the dead eye slot , and the one with the hat takes a headshot",['neutral']
"We discussed vaping, but decided against trying it due to the cost of investment in the equipment.",[27],ed6i2em,1,98,17,['neutral'],discussed vaping decided trying due cost investment equipment,"We discussed vaping , but decided against trying it due to the cost of investment in the equipment .",['neutral']
[NAME] THAT HURTS DON'T DO THAT,[25],eebgz4u,1,31,6,['sadness'],name hurts,[ NAME ] THAT HURTS DO N'T DO THAT,['negative']
i didnt realize i was avoiding a question. i am afraid to talk to cops to be honest. even my own mother doesnt know what i saw,[14],ees0xpj,1,126,27,['fear'],didnt realize avoiding question afraid talk cops honest even mother doesnt know saw,i didnt realize i was avoiding a question . i am afraid to talk to cops to be honest . even my own mother doesnt know what i saw,['negative']
Usually they treat what they know. They cannot write down that they are treating you for BPD until you are officially diagnosed.,[27],ef18sy0,1,128,22,['neutral'],usually treat know write treating bpd officially diagnosed,Usually they treat what they know . They can not write down that they are treating you for BPD until you are officially diagnosed .,['neutral']
I have a hunch that [NAME] is the mastermind of the whole operation.,[0],eey577y,1,68,13,['admiration'],hunch name mastermind whole operation,I have a hunch that [ NAME ] is the mastermind of the whole operation .,['positive']
At least a feed of diazies stops me shitting the bed over the idea of a man wearing a dress. Uppa fuckin erps!!!,[2],edcfkgc,1,112,23,['anger'],least feed diazies stops shitting bed idea man wearing dress uppa fuckin erps,At least a feed of diazies stops me shitting the bed over the idea of a man wearing a dress . Uppa fuckin erps ! ! !,['negative']
thats terrifying. how can people do that to their own citizens?,[14],ed4od6x,1,63,11,['fear'],thats terrifying people citizens,thats terrifying . how can people do that to their own citizens ?,['negative']
I'd love to see something following her younger days. Also something STRQ related would be awesome.,[18],ef3sbhn,1,99,16,['love'],love see something following younger days also something strq related would awesome,I 'd love to see something following her younger days . Also something STRQ related would be awesome .,['positive']
People requesting asylum are not illegal immigrants so that argument is bull shit. Get informed by an actual news source please,[3],eddva85,1,127,21,['annoyance'],people requesting asylum illegal immigrants argument bull shit get informed actual news source please,People requesting asylum are not illegal immigrants so that argument is bull shit . Get informed by an actual news source please,['negative']
I thought you were going to say something about that gross toenail on he left foot. She'll need an industrial grinder to take care of that.,[27],eel8iho,1,139,26,['neutral'],thought going say something gross toenail left foot need industrial grinder take care,I thought you were going to say something about that gross toenail on he left foot . She 'll need an industrial grinder to take care of that .,['neutral']
In the post fight presser [NAME] was making fun of it and asking how long it’s going to be around,[27],eek2fca,1,97,20,['neutral'],post fight presser name making fun asking long going around,In the post fight presser [ NAME ] was making fun of it and asking how long it ’ s going to be around,['neutral']
"It's in my top 3 songs, with heard em say, and through the wire. Such great tracks",[0],eelu8mw,1,82,17,['admiration'],top 3 songs heard em say wire great tracks,"It 's in my top 3 songs , with heard em say , and through the wire . Such great tracks",['positive']
No we're not? Y'know the capsule bug happened on every server and not the ones which fit your narrative,[27],ee1vqi9,1,103,19,['neutral'],capsule bug happened every server ones fit narrative,No we 're not ? Y'know the capsule bug happened on every server and not the ones which fit your narrative,['neutral']
That's a weird answer.,[3],eebl6ee,1,22,4,['annoyance'],weird answer,That 's a weird answer .,['negative']
I guess learning French in school helped me for once,[22],eeszrvg,1,52,10,['realization'],guess learning french school helped,I guess learning French in school helped me for once,['ambiguous']
It’s a rough time I hope your Ex wife gets better.,[20],ef282hb,1,50,11,['optimism'],rough time hope ex wife gets better,It ’ s a rough time I hope your Ex wife gets better .,['positive']
Sometimes I think the Padres link these rumors just to remind the world they still exist. ... But it would be fun if they actually came true.,[1],eessxb9,1,141,27,['amusement'],sometimes think padres link rumors remind world still exist would fun actually came true,Sometimes I think the Padres link these rumors just to remind the world they still exist . ... But it would be fun if they actually came true .,['positive']
Who is this?,[27],ee0t7zo,1,12,3,['neutral'],,Who is this ?,['neutral']
"I love how the reason for the dislocation got progressively less extreme until the ""I was sitting down"" Man, getting old sucks",[18],eegaml3,1,126,22,['love'],love reason dislocation got progressively less extreme sitting man getting old sucks,"I love how the reason for the dislocation got progressively less extreme until the `` I was sitting down '' Man , getting old sucks",['positive']
Theres a BIG difference between being against ones (hateful) political position and between harassing someone for his ethnicity.,[3],eeit3v8,1,128,18,['annoyance'],theres big difference ones hateful political position harassing someone ethnicity,Theres a BIG difference between being against ones ( hateful ) political position and between harassing someone for his ethnicity .,['negative']
Penis voters.,[27],ef1yois,1,13,2,['neutral'],penis voters,Penis voters .,['neutral']
"Good luck, I hope you find it really easy! I did, and I’ve never looked back :)",[20],eegm1bo,1,79,17,['optimism'],good luck hope find really easy never looked back,"Good luck , I hope you find it really easy ! I did , and I ’ ve never looked back : )",['positive']
Thankyou! :),[15],ef1mie3,1,12,2,['gratitude'],thankyou,Thankyou ! : ),['positive']
"They most likely did, since they still having bank issues.",[27],ef6f9mw,1,58,10,['neutral'],likely since still bank issues,"They most likely did , since they still having bank issues .",['neutral']
How is anyone so stupid to not vaccinate their child?,[3],eew88ky,1,53,10,['annoyance'],anyone stupid vaccinate child,How is anyone so stupid to not vaccinate their child ?,['negative']
"[NAME], legendary skater",[0],ed9ik24,1,24,3,['admiration'],name legendary skater,"[ NAME ] , legendary skater",['positive']
One of the best photos I’ve seen of the Arch. Breathtaking.,[0],ee09ar7,1,59,11,['admiration'],one best photos seen arch breathtaking,One of the best photos I ’ ve seen of the Arch . Breathtaking .,['positive']
"If high calorie food is so cheap, eat less of it and save even more money without getting fat.","[4, 22]",edgedom,2,94,19,"['approval', 'realization']",high calorie food cheap eat less save even money without getting fat,"If high calorie food is so cheap , eat less of it and save even more money without getting fat .","['ambiguous', 'positive']"
"Me too, [NAME]. Me too.",[27],eeqyfhy,1,23,5,['neutral'],name,"Me too , [ NAME ] . Me too .",['neutral']
"This is wild omg. Also, happy cake day twin!","[13, 17]",edfxsgw,2,44,9,"['excitement', 'joy']",wild omg also happy cake day twin,"This is wild omg . Also , happy cake day twin !",['positive']
...math?,[27],eeq0b04,1,8,1,['neutral'],math,... math ?,['neutral']
Why is this getting downvoted?,[27],eeykdif,1,30,5,['neutral'],getting downvoted,Why is this getting downvoted ?,['neutral']
Who could have thought that anti-semitism would have taken hold in feminism? Why would anyone think that animosity toward an entire group of people is welcome there?,[7],edcz0n3,1,165,27,['curiosity'],could thought would taken hold feminism would anyone think animosity toward entire group people welcome,Who could have thought that anti-semitism would have taken hold in feminism ? Why would anyone think that animosity toward an entire group of people is welcome there ?,['ambiguous']
I used to have a pet rat. She was the best pet I ever had.,[0],ee9b3g2,1,58,15,['admiration'],used pet rat best pet ever,I used to have a pet rat . She was the best pet I ever had .,['positive']
TSA agents are like tow truck drivers. Everyone hates them.,"[2, 27]",ee3rtkg,2,59,10,"['anger', 'neutral']",tsa agents like tow truck drivers everyone hates,TSA agents are like tow truck drivers . Everyone hates them .,"['negative', 'neutral']"
"I have no advice, but I can commiserate, and offer hugs.",[27],edh8gu4,1,56,11,['neutral'],advice commiserate offer hugs,"I have no advice , but I can commiserate , and offer hugs .",['neutral']
Make a doctor's appointment and say you are experiencing lack of sleep because of anxiety. Doesn't get easier.,"[5, 25]",edq9ij8,2,110,18,"['caring', 'sadness']",make doctor appointment say experiencing lack sleep anxiety get easier,Make a doctor 's appointment and say you are experiencing lack of sleep because of anxiety . Does n't get easier .,"['negative', 'positive']"
The worst is starting out in a new relationship after leaving a failing one. You want to fall but you know how much the breakups hurt,"[9, 11]",ef02p7i,2,133,26,"['disappointment', 'disgust']",worst starting new relationship leaving failing one want fall know much breakups hurt,The worst is starting out in a new relationship after leaving a failing one . You want to fall but you know how much the breakups hurt,['negative']
Also there's better ways we can spend taxpayer dollars than on another election.,[27],eddockp,1,80,13,['neutral'],also better ways spend taxpayer dollars another election,Also there 's better ways we can spend taxpayer dollars than on another election .,['neutral']
"My ego is pretty ok. My fun-o-meter is a little off and needs calibration probably, though.","[4, 22]",edtpv8c,2,91,16,"['approval', 'realization']",ego pretty little needs calibration probably though,"My ego is pretty ok. My fun-o-meter is a little off and needs calibration probably , though .","['ambiguous', 'positive']"
I want a DL thats about 800€ for a month is the one who's new here lol.,"[1, 8]",eewgcrb,2,71,17,"['amusement', 'desire']",want dl thats month one new lol,I want a DL thats about 800€ for a month is the one who 's new here lol .,['positive']
That kid would be so young that he'd only have a chance to appear and fight in a sequel series.,[27],eeqnf8d,1,95,20,['neutral'],kid would young chance appear fight sequel series,That kid would be so young that he 'd only have a chance to appear and fight in a sequel series .,['neutral']
You look Beautiful! Curls are wonderful!,[0],eeb8327,1,40,6,['admiration'],look beautiful curls wonderful,You look Beautiful ! Curls are wonderful !,['positive']
"Whoops, I'm* dying. But I wish, they make so much money. ","[8, 25]",ef551t9,2,57,11,"['desire', 'sadness']",whoops dying wish make much money,"Whoops , I 'm * dying . But I wish , they make so much money .","['negative', 'positive']"
Exactly. Some ammo is already cheaper than that.,"[3, 4]",eerdg34,2,48,8,"['annoyance', 'approval']",exactly ammo already cheaper,Exactly . Some ammo is already cheaper than that .,"['negative', 'positive']"
How dare you hate [NAME],[2],eegoom7,1,24,5,['anger'],dare hate name,How dare you hate [ NAME ],['negative']
They make money to sit and talk to you there's no reason to feel like a burdon cause it's legit their job.,[3],eet478g,1,106,22,['annoyance'],make money sit talk reason feel like burdon cause legit job,They make money to sit and talk to you there 's no reason to feel like a burdon cause it 's legit their job .,['negative']
The pistons are aggressively mediocre which sucks. [NAME] has been awesome but the rest of the team is horrid,[0],eeukytl,1,109,19,['admiration'],pistons aggressively mediocre sucks name awesome rest team horrid,The pistons are aggressively mediocre which sucks . [ NAME ] has been awesome but the rest of the team is horrid,['positive']
Now she just needs to put start stealing hams and then if they ask she can show her stump and she will get away with it,[27],eezgszx,1,119,26,['neutral'],needs put start stealing hams ask show stump get away,Now she just needs to put start stealing hams and then if they ask she can show her stump and she will get away with it,['neutral']
