text,labels,id,num_labels,char_len,word_len,label_names,text_clean_tfidf,text_clean_transformer,grouped_labels
Probably but we kind of need a lefty though to pair with caleb. Maybe [NAME] steps up again but you know we need more options.,[27],ed5269y,1,126,25,['neutral'],probably kind need lefty though pair caleb maybe name steps know need options,Probably but we kind of need a lefty though to pair with caleb . Maybe [ NAME ] steps up again but you know we need more options .,['neutral']
I would love to see an [NAME] cosplay!,[18],effuuwv,1,38,8,['love'],would love see name cosplay,I would love to see an [ NAME ] cosplay !,['positive']
That's what you get for being a drama queen.,[27],ef05d3d,1,44,9,['neutral'],get drama queen,That 's what you get for being a drama queen .,['neutral']
State = good Anarcho-capitalism = bad Have fun getting taxed.,[27],ef9hqmg,1,61,10,['neutral'],state good bad fun getting taxed,State = good Anarcho-capitalism = bad Have fun getting taxed .,['neutral']
The pain for the victims just goes on and on. He was outrageously vile to the end as he continued his efforts to flip the narrative.,[27],eedd511,1,132,26,['neutral'],pain victims goes outrageously vile end continued efforts flip narrative,The pain for the victims just goes on and on . He was outrageously vile to the end as he continued his efforts to flip the narrative .,['neutral']
Because it was windy ...,[27],efh5xv5,1,24,5,['neutral'],windy,Because it was windy ...,['neutral']
Is that seriously the story? I haven’t googled it. I just thought it was cool as a WW2 buff,[26],eduzvf5,1,91,19,['surprise'],seriously story googled thought cool ww2 buff,Is that seriously the story ? I haven ’ t googled it . I just thought it was cool as a WW2 buff,['ambiguous']
It's my masterpiece.,[21],eemtr6t,1,20,3,['pride'],masterpiece,It 's my masterpiece .,['positive']
Now he needs a skin care routine!,[27],ed9s6x4,1,33,7,['neutral'],needs skin care routine,Now he needs a skin care routine !,['neutral']
"Wait so you can do that infinitely, even with placed campfires?",[6],eertrvd,1,63,11,['confusion'],wait infinitely even placed campfires,"Wait so you can do that infinitely , even with placed campfires ?",['ambiguous']
LOL. Super cute!,"[0, 1]",ed7nnui,2,16,3,"['admiration', 'amusement']",lol super cute,LOL . Super cute !,['positive']
My gf is a huge TSwift fan and loves Friends. R u tryna steal my girl pal,[18],ef7t5xm,1,73,17,['love'],gf huge tswift fan loves friends r u tryna steal girl pal,My gf is a huge TSwift fan and loves Friends . R u tryna steal my girl pal,['positive']
"I wish yall would stay off the fucking roads when youre drinking beer. Mind you, on a bike I may just get that wish after your first night out.",[8],edrosmh,1,143,29,['desire'],wish yall would stay fucking roads youre drinking beer mind bike may get wish first night,"I wish yall would stay off the fucking roads when youre drinking beer . Mind you , on a bike I may just get that wish after your first night out .",['positive']
> Caveman coding. Blunt force coding. BUBBLE SORT!,[27],effp6ya,1,50,8,['neutral'],caveman coding blunt force coding bubble sort,> Caveman coding . Blunt force coding . BUBBLE SORT !,['neutral']
thanks for sharing.,[15],eed4sfn,1,19,3,['gratitude'],thanks sharing,thanks for sharing .,['positive']
"Why do people procreate, only to bring to earth a clone of themselves that's not attractive in any way. ",[6],edp5rrb,1,104,19,['confusion'],people procreate bring earth clone attractive way,"Why do people procreate , only to bring to earth a clone of themselves that 's not attractive in any way .",['ambiguous']
[NAME] cares like a father incredible,[5],efdzr2t,1,37,6,['caring'],name cares like father incredible,[ NAME ] cares like a father incredible,['positive']
I think [NAME] was pulled in that moment into the “World between Worlds” just as [NAME] on Malachor.,[27],ee0mmp3,1,100,18,['neutral'],think name pulled moment world worlds name malachor,I think [ NAME ] was pulled in that moment into the “ World between Worlds ” just as [ NAME ] on Malachor .,['neutral']
You gonn give me one of dem?,[6],efemepz,1,28,7,['confusion'],gonn give one dem,You gonn give me one of dem ?,['ambiguous']
Her meal looks pretty good...,[0],ef3dc1f,1,29,5,['admiration'],meal looks pretty good,Her meal looks pretty good ...,['positive']
"Oh, [NAME] ",[27],eddikqz,1,11,2,['neutral'],oh name,"Oh , [ NAME ]",['neutral']
Why can't America be this cool?,[27],edgtqei,1,31,6,['neutral'],ca america cool,Why ca n't America be this cool ?,['neutral']
"Sounds like a problem with how you are playing, not with the perk.",[27],ee9ita6,1,66,13,['neutral'],sounds like problem playing perk,"Sounds like a problem with how you are playing , not with the perk .",['neutral']
"Clever, original, and a little knotty. Nice work.",[0],edlub3n,1,49,8,['admiration'],clever original little knotty nice work,"Clever , original , and a little knotty . Nice work .",['positive']
Close enough. Is rainbow 6 any good?,[7],eeksfkj,1,36,7,['curiosity'],close enough rainbow 6 good,Close enough . Is rainbow 6 any good ?,['ambiguous']
"I honestly don't know much about them at all, but hey, I'm young and I don't know everything yet, so.",[27],eevwhla,1,101,20,['neutral'],honestly know much hey young know everything yet,"I honestly do n't know much about them at all , but hey , I 'm young and I do n't know everything yet , so .",['neutral']
Ugh. People are the worst!,[11],ef13jjj,1,26,5,['disgust'],ugh people worst,Ugh . People are the worst !,['negative']
Omg they are adding audio???!! Epic really loves to cater to the sweats,[13],efcje3t,1,71,13,['excitement'],omg adding audio epic really loves cater sweats,Omg they are adding audio ? ? ? ! ! Epic really loves to cater to the sweats,['positive']
"The calls are totally random so no regulars sadly. But on the plus side, you get to help so many more people! ",[27],eeqkvwj,1,110,22,['neutral'],calls totally random regulars sadly plus side get help many people,"The calls are totally random so no regulars sadly . But on the plus side , you get to help so many more people !",['neutral']
That guy who melodramatically dances around playing horribly soppy poppy chord progressions over and over and does a cringy dance that makes me want to kill things?,[6],eet2bie,1,164,27,['confusion'],guy melodramatically dances around playing horribly soppy poppy chord progressions cringy dance makes want kill things,That guy who melodramatically dances around playing horribly soppy poppy chord progressions over and over and does a cringy dance that makes me want to kill things ?,['ambiguous']
I agree it seemed very odd the whole live stream...,[4],eeja2b2,1,51,10,['approval'],agree seemed odd whole live stream,I agree it seemed very odd the whole live stream ...,['positive']
Gives me physical pain thanks,[15],edpx1eb,1,29,5,['gratitude'],gives physical pain thanks,Gives me physical pain thanks,['positive']
I did not even realize he was injured...,[25],ed4bn65,1,40,8,['sadness'],even realize injured,I did not even realize he was injured ...,['negative']
"Lol, some guntards stepped out of the echo chamber and sounded completely unhinged.",[1],ee2m5oh,1,83,13,['amusement'],lol guntards stepped echo chamber sounded completely unhinged,"Lol , some guntards stepped out of the echo chamber and sounded completely unhinged .",['positive']
"Thanks, that's what I was looking for! ",[15],ed3m8lj,1,39,7,['gratitude'],thanks looking,"Thanks , that 's what I was looking for !",['positive']
"Same director for both series, and one of the best in the business.",[0],edn5w5b,1,67,13,['admiration'],director series one best business,"Same director for both series , and one of the best in the business .",['positive']
"If you take that line, any excess money you have is immoral. Tough line to tow.",[10],eczp2oc,1,79,16,['disapproval'],take line excess money immoral tough line tow,"If you take that line , any excess money you have is immoral . Tough line to tow .",['negative']
So glad you left this note. This is the way it’s done! Newspaper (or similar) and everything.,[0],edlrme8,1,93,17,['admiration'],glad left note way done newspaper similar everything,So glad you left this note . This is the way it ’ s done ! Newspaper ( or similar ) and everything .,['positive']
> I don’t understand the boot-licking mentality Calling it in 5 years. That's your future AP.,[6],efh9p9h,1,93,16,['confusion'],understand mentality calling 5 years future ap,> I don ’ t understand the boot-licking mentality Calling it in 5 years . That 's your future AP .,['ambiguous']
"Wow, I love the car ride idea. Thanks for sharing that!","[15, 18]",eeq4kos,2,55,11,"['gratitude', 'love']",wow love car ride idea thanks sharing,"Wow , I love the car ride idea . Thanks for sharing that !",['positive']
Thanks. I appreciate your advice. It is what I was looking for. Thanks again.,"[0, 15]",ed97p1u,2,77,14,"['admiration', 'gratitude']",thanks appreciate advice looking thanks,Thanks . I appreciate your advice . It is what I was looking for . Thanks again .,['positive']
"Can I comment on the lost opportunity/remarkable restraint by [NAME] to not have a ""MLK I Have a Dream Mattress Sale""",[7],eeczpcn,1,117,21,['curiosity'],comment lost restraint name mlk dream mattress sale,Can I comment on the lost opportunity/remarkable restraint by [ NAME ] to not have a `` MLK I Have a Dream Mattress Sale '',['ambiguous']
I hope you have a wonderful cake day!,[20],edy2cqj,1,37,8,['optimism'],hope wonderful cake day,I hope you have a wonderful cake day !,['positive']
I totally agree man I hope one day I can find that too,"[4, 20]",ednotey,2,54,13,"['approval', 'optimism']",totally agree man hope one day find,I totally agree man I hope one day I can find that too,['positive']
"It's barely a jumpscare tho, i dont get how this could be startling at all",[10],edpkr4t,1,74,15,['disapproval'],barely jumpscare tho dont get could startling,"It 's barely a jumpscare tho , i dont get how this could be startling at all",['negative']
I think they are leaving it up because they know they can't delete it.,[27],ee691bd,1,70,14,['neutral'],think leaving know ca delete,I think they are leaving it up because they know they ca n't delete it .,['neutral']
"[NAME] can hear you over the internet, don't be so loud",[27],ef3xgn2,1,55,11,['neutral'],name hear internet loud,"[ NAME ] can hear you over the internet , do n't be so loud",['neutral']
"a must win game if we have any ambitions for 8th seed, even with [NAME]. any news on him & jsimms?",[7],ed30zs6,1,98,21,['curiosity'],must win game ambitions 8th seed even name news jsimms,"a must win game if we have any ambitions for 8th seed , even with [ NAME ] . any news on him & jsimms ?",['ambiguous']
Thank you TC for getting us to 100!,[15],eczg9dp,1,35,8,['gratitude'],thank tc getting us 100,Thank you TC for getting us to 100 !,['positive']
Just cooked me some chorizo and an omelette with tortillas at half time. The tortilla gods are now pleased.,[27],edx25h3,1,107,19,['neutral'],cooked chorizo omelette tortillas half time tortilla gods pleased,Just cooked me some chorizo and an omelette with tortillas at half time . The tortilla gods are now pleased .,['neutral']
Lets see if [NAME] cares about playing hard in [NAME] return to LA. I think we can win if our players actually play hard and care.,[20],edwy4p8,1,130,26,['optimism'],lets see name cares playing hard name return la think win players actually play hard care,Lets see if [ NAME ] cares about playing hard in [ NAME ] return to LA . I think we can win if our players actually play hard and care .,['positive']
> a new release is imminent. Hahahaha,[1],efagr1k,1,37,7,['amusement'],new release imminent hahahaha,> a new release is imminent . Hahahaha,['positive']
What's the song name?,[7],eenhyje,1,21,4,['curiosity'],song name,What 's the song name ?,['ambiguous']
"Shut up, Mag!",[2],ed9bsv5,1,13,3,['anger'],shut mag,"Shut up , Mag !",['negative']
"Broncos one was harder being state rivals and us being spoken of as possible contenders, only to get smashed after taking an early lead",[27],eewmaso,1,135,24,['neutral'],broncos one harder state rivals us spoken possible contenders get smashed taking early lead,"Broncos one was harder being state rivals and us being spoken of as possible contenders , only to get smashed after taking an early lead",['neutral']
"Ah, I forgot humor can be objectively measured. ",[22],efgi8hp,1,48,8,['realization'],ah forgot humor objectively measured,"Ah , I forgot humor can be objectively measured .",['ambiguous']
"Sounds like she wants dessert, but hates you eating any cake. ",[27],ee5pxrn,1,62,11,['neutral'],sounds like wants dessert hates eating cake,"Sounds like she wants dessert , but hates you eating any cake .",['neutral']
Oh you mean the time when the world was controlled by individual land owners who created their own states,[27],ef5xt9g,1,105,19,['neutral'],oh mean time world controlled individual land owners created states,Oh you mean the time when the world was controlled by individual land owners who created their own states,['neutral']
"Watch out, [NAME]!! [NAME] is right behind you. Oh god oh fuck he can’t hear us, he has AirPods.",[2],eefkowz,1,96,19,['anger'],watch name name right behind oh god oh fuck hear us airpods,"Watch out , [ NAME ] ! ! [ NAME ] is right behind you . Oh god oh fuck he can ’ t hear us , he has AirPods .",['negative']
That wasn’t part of my plan,[10],ef4zgb5,1,27,6,['disapproval'],part plan,That wasn ’ t part of my plan,['negative']
"They also don’t like him, remember these people have to work with him ",[27],eew3un3,1,70,13,['neutral'],also like remember people work,"They also don ’ t like him , remember these people have to work with him",['neutral']
it's harder for them to do it in person.,[27],efh39ok,1,40,9,['neutral'],harder person,it 's harder for them to do it in person .,['neutral']
Thank you for your service,[15],edl0zcn,1,26,5,['gratitude'],thank service,Thank you for your service,['positive']
So THIS is what it's like to have a seizure when listening to self control...,[4],ede9itx,1,77,15,['approval'],like seizure listening self control,So THIS is what it 's like to have a seizure when listening to self control ...,['positive']
I love juancho,[18],ed75r2m,1,14,3,['love'],love juancho,I love juancho,['positive']
Genius. I'm so doing this,[0],eenxu8m,1,25,5,['admiration'],genius,Genius . I 'm so doing this,['positive']
They’re still around but part of NLF. Also weaker than they used to be.,[27],edn2v7p,1,71,14,['neutral'],still around part nlf also weaker used,They ’ re still around but part of NLF . Also weaker than they used to be .,['neutral']
What are these words? I'm so confused.,[6],edc4ord,1,38,7,['confusion'],words confused,What are these words ? I 'm so confused .,['ambiguous']
"No, she tried and failed lmao",[1],ed28fsu,1,29,6,['amusement'],tried failed lmao,"No , she tried and failed lmao",['positive']
"I used to live there (Hell) and I had this religious/fundy coworker who used to love to point out that ""DARWIN Road leads to HELL!"" ",[27],efcwkcf,1,132,25,['neutral'],used live hell coworker used love point darwin road leads hell,I used to live there ( Hell ) and I had this religious/fundy coworker who used to love to point out that `` DARWIN Road leads to HELL ! '',['neutral']
"Well, you've spent two hours.",[27],eduo0oq,1,29,5,['neutral'],well spent two hours,"Well , you 've spent two hours .",['neutral']
"A one-line whip is still whipping against, although it is a pretty disappointing decision.",[9],ef6p3fr,1,90,14,['disappointment'],whip still whipping although pretty disappointing decision,"A one-line whip is still whipping against , although it is a pretty disappointing decision .",['negative']
I apologize. Wasn’t aware but thanks for letting me know.,"[15, 24]",eest5bf,2,57,10,"['gratitude', 'remorse']",apologize aware thanks letting know,I apologize . Wasn ’ t aware but thanks for letting me know .,"['negative', 'positive']"
Will you ask her to pray to her god and ask him to stop giving kids cancer!,[20],edpfclp,1,75,17,['optimism'],ask pray god ask stop giving kids cancer,Will you ask her to pray to her god and ask him to stop giving kids cancer !,['positive']
False. Drop bears.,[10],ee1b1ss,1,18,3,['disapproval'],false drop bears,False . Drop bears .,['negative']
Isnt that the god awful truth,[7],ef5abni,1,29,6,['curiosity'],isnt god awful truth,Isnt that the god awful truth,['ambiguous']
😅 sorry. Lol,[1],eez8pnj,1,12,3,['amusement'],sorry lol,😅 sorry . Lol,['positive']
All hail valve I guess?,[27],edpqw3o,1,23,5,['neutral'],hail valve guess,All hail valve I guess ?,['neutral']
"You don't have to, but I find it dissolves faster so I assume that's why he's doing it.",[27],edcktjv,1,87,18,['neutral'],find dissolves faster assume,"You do n't have to , but I find it dissolves faster so I assume that 's why he 's doing it .",['neutral']
> Religion Lol the cowardice that you won't say '[RELIGION]'.,[1],edcrusm,1,61,10,['amusement'],religion lol cowardice wo say religion,> Religion Lol the cowardice that you wo n't say ' [ RELIGION ] ' .,['positive']
Well that’s sad. It might’ve been funny if it was fake.,[25],eeiylfw,1,55,11,['sadness'],well sad might funny fake,Well that ’ s sad . It might ’ ve been funny if it was fake .,['negative']
Your attempts to belittle me show only more insecurities on your part.,"[3, 27]",ef95cd7,2,70,12,"['annoyance', 'neutral']",attempts belittle show insecurities part,Your attempts to belittle me show only more insecurities on your part .,"['negative', 'neutral']"
"I've spent too much of my life being angry at the Jets, just gotta roll with it now.","[9, 20]",edow6dx,2,84,18,"['disappointment', 'optimism']",spent much life angry jets got ta roll,"I 've spent too much of my life being angry at the Jets , just got ta roll with it now .","['negative', 'positive']"
While you were listening to [NAME] he was idolizing [NAME].,[0],edyv4nl,1,59,10,['admiration'],listening name idolizing name,While you were listening to [ NAME ] he was idolizing [ NAME ] .,['positive']
There are a few. I've gotten a couple messages. Thanks for the support but people judging my throwaway account... who cares?,"[7, 15]",eeml70u,2,124,21,"['curiosity', 'gratitude']",gotten couple messages thanks support people judging throwaway account cares,There are a few . I 've gotten a couple messages . Thanks for the support but people judging my throwaway account ... who cares ?,"['ambiguous', 'positive']"
How dare you not find domestic abuse funny! /s,"[2, 3]",eeglgxa,2,46,9,"['anger', 'annoyance']",dare find domestic abuse funny,How dare you not find domestic abuse funny ! /s,['negative']
"Considering the fact that I don't consider jealousy or envy useful, you are dead wrong. It might be other people but not me.","[3, 10]",ef9wlwj,2,124,23,"['annoyance', 'disapproval']",considering fact consider jealousy envy useful dead wrong might people,"Considering the fact that I do n't consider jealousy or envy useful , you are dead wrong . It might be other people but not me .",['negative']
Slave labor because the wage savings will be more money to bribe FIFA !,[27],edqpjnb,1,71,14,['neutral'],slave labor wage savings money bribe fifa,Slave labor because the wage savings will be more money to bribe FIFA !,['neutral']
This just made my day! Thanks for the laugh!!,[1],ee66woa,1,45,9,['amusement'],made day thanks laugh,This just made my day ! Thanks for the laugh ! !,['positive']
"It's the ""boyfriend around school haha jk"" thing that makes it weird.","[1, 3]",eeximq1,2,69,12,"['amusement', 'annoyance']",boyfriend around school haha jk thing makes weird,It 's the `` boyfriend around school haha jk '' thing that makes it weird .,"['negative', 'positive']"
With the way [NAME] carried himself in Hard Knocks I wouldn’t be surprised if he flew off the handle during his firing.,"[0, 26]",eeuwoqv,2,119,22,"['admiration', 'surprise']",way name carried hard knocks surprised flew handle firing,With the way [ NAME ] carried himself in Hard Knocks I wouldn ’ t be surprised if he flew off the handle during his firing .,"['ambiguous', 'positive']"
This isn't cringe at all. He's making a joke.,"[1, 27]",eerhhsn,2,45,9,"['amusement', 'neutral']",cringe making joke,This is n't cringe at all . He 's making a joke .,"['neutral', 'positive']"
There's a difference between use and ownership. They aren't equivalent.,[10],ee6d49x,1,71,10,['disapproval'],difference use ownership equivalent,There 's a difference between use and ownership . They are n't equivalent .,['negative']
"Sure. Let’s start with the terrorists with the biggest guns. How about Israel, or Saudi Arabia? ","[4, 27]",eegg6z2,2,96,16,"['approval', 'neutral']",sure let start terrorists biggest guns israel saudi arabia,"Sure . Let ’ s start with the terrorists with the biggest guns . How about Israel , or Saudi Arabia ?","['neutral', 'positive']"
Whoever the mod is that removed this needs to rethink their priorities.,[27],ediu6ag,1,71,12,['neutral'],whoever mod removed needs rethink priorities,Whoever the mod is that removed this needs to rethink their priorities .,['neutral']
Counteracting my cold soul takes sacrifice,[27],efefr7x,1,42,6,['neutral'],counteracting cold soul takes sacrifice,Counteracting my cold soul takes sacrifice,['neutral']
Perfect dynamite moment. Rank up those buckles.,[0],edyzhjy,1,47,7,['admiration'],perfect dynamite moment rank buckles,Perfect dynamite moment . Rank up those buckles .,['positive']
That's a bit violent...... But then again I'm a [NAME] so whatever,[27],eeucowm,1,66,12,['neutral'],bit violent name whatever,That 's a bit violent ...... But then again I 'm a [ NAME ] so whatever,['neutral']
Thank you for sharing your experience. It adds much needed hope.,[15],edpqsj9,1,64,11,['gratitude'],thank sharing experience adds much needed hope,Thank you for sharing your experience . It adds much needed hope .,['positive']
Trolls are okay in this sub but let's be more serious here,[4],effjfum,1,58,12,['approval'],trolls okay sub let serious,Trolls are okay in this sub but let 's be more serious here,['positive']
[NAME] did a job for us,[27],eegr5vq,1,23,6,['neutral'],name job us,[ NAME ] did a job for us,['neutral']
There was no Israel then dumbass!,"[3, 10]",eei74wb,2,33,6,"['annoyance', 'disapproval']",israel dumbass,There was no Israel then dumbass !,['negative']
I'm not crying YOU are crying!!,[4],edywep7,1,31,6,['approval'],crying crying,I 'm not crying YOU are crying ! !,['positive']
And then everyone clapped,[27],ed97dtw,1,25,4,['neutral'],everyone clapped,And then everyone clapped,['neutral']
That was the chillest Sharks GDT against an Eastern Conference team in a while.,[22],ee6dv3m,1,79,14,['realization'],chillest sharks gdt eastern conference team,That was the chillest Sharks GDT against an Eastern Conference team in a while .,['ambiguous']
5 months until parole,[22],eex4gok,1,21,4,['realization'],5 months parole,5 months until parole,['ambiguous']
I'm sure HMB Barbers at Nundah village will look after you,[4],ee905n9,1,58,11,['approval'],sure hmb barbers nundah village look,I 'm sure HMB Barbers at Nundah village will look after you,['positive']
"Alright, see ya man",[27],ee2yb8n,1,19,4,['neutral'],alright see ya man,"Alright , see ya man",['neutral']
This is almost a r/ATBGE situation,[27],eepawp8,1,34,6,['neutral'],almost situation,This is almost a r/ATBGE situation,['neutral']
Wait no monkeys? My helper monkey Mojo is very necessary for our family trip to itchy and scratchy land,[27],efbz62r,1,103,19,['neutral'],wait monkeys helper monkey mojo necessary family trip itchy scratchy land,Wait no monkeys ? My helper monkey Mojo is very necessary for our family trip to itchy and scratchy land,['neutral']
That's kind of sad to be honest.,[25],edar4fs,1,32,7,['sadness'],kind sad honest,That 's kind of sad to be honest .,['negative']
So why wouldn’t the white Sox just offer an extra $20 million,"[7, 20]",edku823,2,61,12,"['curiosity', 'optimism']",white sox offer extra 20 million,So why wouldn ’ t the white Sox just offer an extra $ 20 million,"['ambiguous', 'positive']"
BOOO THIS WAS RIGGED,[27],ee38dqc,1,20,4,['neutral'],booo rigged,BOOO THIS WAS RIGGED,['neutral']
Thanks now I want a subway!,[15],edhhzr3,1,27,6,['gratitude'],thanks want subway,Thanks now I want a subway !,['positive']
50 becoz I’ve used before and it’s A really intense high but after a bit of research I’m extremely hesitant to use it again,[9],edqdkea,1,123,24,['disappointment'],50 becoz used really intense high bit research extremely hesitant use,50 becoz I ’ ve used before and it ’ s A really intense high but after a bit of research I ’ m extremely hesitant to use it again,['negative']
"This is absolutely lerfect, fantastic lunchpine.",[0],eejqnzn,1,48,6,['admiration'],absolutely lerfect fantastic lunchpine,"This is absolutely lerfect , fantastic lunchpine .",['positive']
"Thank you, that's very good to know!",[15],ed938lq,1,36,7,['gratitude'],thank good know,"Thank you , that 's very good to know !",['positive']
"Maybe you should try watching it before commenting on it, otherwise your just posting from a position of ignorance. ",[10],ee7g9qi,1,116,19,['disapproval'],maybe try watching commenting otherwise posting position ignorance,"Maybe you should try watching it before commenting on it , otherwise your just posting from a position of ignorance .",['negative']
Bet that'd cut down on road traffic accidents.,[27],eeagv14,1,46,8,['neutral'],bet cut road traffic accidents,Bet that 'd cut down on road traffic accidents .,['neutral']
