text,labels,id,num_labels,char_len,word_len,label_names,text_clean_tfidf,text_clean_transformer,grouped_labels
[NAME] wrote a really technical and really awesome article in the Athletic about this game. Holy shit haha worth reading if you are a ball nerd.,"[0, 1]",ee1utpx,2,144,26,"['admiration', 'amusement']",name wrote really technical really awesome article athletic game holy shit haha worth reading ball nerd,[ NAME ] wrote a really technical and really awesome article in the Athletic about this game . Holy shit haha worth reading if you are a ball nerd .,['positive']
"And much like The Lions past, future and present it's not looking bright.",[27],edj514i,1,73,13,['neutral'],much like lions past future present looking bright,"And much like The Lions past , future and present it 's not looking bright .",['neutral']
Non horny girls do.,[27],edpa7ii,1,19,4,['neutral'],non horny girls,Non horny girls do .,['neutral']
Yous offered the guy a contract and he rejected you. Probably couldn’t afford him lol,[1],edr3hu4,1,85,15,['amusement'],yous offered guy contract rejected probably afford lol,Yous offered the guy a contract and he rejected you . Probably couldn ’ t afford him lol,['positive']
I'm 24 and still live at home.,[27],eeta9n0,1,30,7,['neutral'],24 still live home,I 'm 24 and still live at home .,['neutral']
"Come on, this would be funny with a better caption.",[1],edk0odx,1,51,10,['amusement'],come would funny better caption,"Come on , this would be funny with a better caption .",['positive']
Plus ultra!,[27],eeiajnl,1,11,2,['neutral'],plus ultra,Plus ultra !,['neutral']
"Just make a better game looool 4Head You shouldn't worry about valve stop working on artifact, at least for a year",[5],edat20u,1,114,21,['caring'],make better game looool 4head worry valve stop working artifact least year,"Just make a better game looool 4Head You should n't worry about valve stop working on artifact , at least for a year",['positive']
Good mythical morning. Hope you get better soon,"[5, 20]",efe7v2z,2,47,8,"['caring', 'optimism']",good mythical morning hope get better soon,Good mythical morning . Hope you get better soon,['positive']
It’s literally a meme ideology. Sstaaaaahhhhpppp,"[3, 27]",ed49az1,2,48,6,"['annoyance', 'neutral']",literally meme ideology sstaaaaahhhhpppp,It ’ s literally a meme ideology . Sstaaaaahhhhpppp,"['negative', 'neutral']"
That's the main reason to play [NAME]? I hate it too.,[2],edsek81,1,53,11,['anger'],main reason play name hate,That 's the main reason to play [ NAME ] ? I hate it too .,['negative']
"Also, this has been said half a million times but the Oilers were not picking [NAME] with that draft pick even if we didn't trade it away.",[27],eej89tz,1,138,27,['neutral'],also said half million times oilers picking name draft pick even trade away,"Also , this has been said half a million times but the Oilers were not picking [ NAME ] with that draft pick even if we did n't trade it away .",['neutral']
"Ah, didn’t know that but can’t blame him. Thanks!",[15],ef4ztjf,1,49,9,['gratitude'],ah know blame thanks,"Ah , didn ’ t know that but can ’ t blame him . Thanks !",['positive']
I’ve had it up to here with these damn rickets!,[27],edu7nc6,1,47,10,['neutral'],damn rickets,I ’ ve had it up to here with these damn rickets !,['neutral']
*US MILITARY WANTS TO KNOW YOUR LOCATION*,[27],ee0uh1b,1,41,7,['neutral'],us military wants know location,* US MILITARY WANTS TO KNOW YOUR LOCATION *,['neutral']
"Yes, things. ",[27],eex214i,1,13,2,['neutral'],yes things,"Yes , things .",['neutral']
"That's awful. If I were a celebrity, I would probably do the same.",[11],efdvcwb,1,66,13,['disgust'],awful celebrity would probably,"That 's awful . If I were a celebrity , I would probably do the same .",['negative']
I remember them looking very happy. I loved that they were there and seemed very happy about what was happening.,"[17, 18]",eeou68l,2,112,20,"['joy', 'love']",remember looking happy loved seemed happy happening,I remember them looking very happy . I loved that they were there and seemed very happy about what was happening .,['positive']
"the Bulls turn cap space into cash money. Doesn't help or hurt the team, but makes the owner happy",[27],eenk3ys,1,98,19,['neutral'],bulls turn cap space cash money help hurt team makes owner happy,"the Bulls turn cap space into cash money . Does n't help or hurt the team , but makes the owner happy",['neutral']
Being seen as a human being. Dating and relationships Friends Most girly clothing,[27],edyocgx,1,81,13,['neutral'],seen human dating relationships friends girly clothing,Being seen as a human being . Dating and relationships Friends Most girly clothing,['neutral']
"The new beserker face ruined him for me. Made him another old, wrinkly hobo.",[3],edbswke,1,76,14,['annoyance'],new beserker face ruined made another old wrinkly hobo,"The new beserker face ruined him for me . Made him another old , wrinkly hobo .",['negative']
This really shows how young and ignorant most of them are.,[3],eeeocjm,1,58,11,['annoyance'],really shows young ignorant,This really shows how young and ignorant most of them are .,['negative']
"Yeeeaaaah, move out and keep showing off the clam.","[5, 27]",edv9tyb,2,50,9,"['caring', 'neutral']",yeeeaaaah move keep showing clam,"Yeeeaaaah , move out and keep showing off the clam .","['neutral', 'positive']"
Do they not remember the SRO who responded to a school shooting returning fire in under a minute.,[27],eesv83h,1,97,18,['neutral'],remember sro responded school shooting returning fire minute,Do they not remember the SRO who responded to a school shooting returning fire in under a minute .,['neutral']
You had great seats!,[0],ed4bf30,1,20,4,['admiration'],great seats,You had great seats !,['positive']
How to delete spam: Learn how to punish sigs you fucking idiot,"[2, 3]",efdodrp,2,62,12,"['anger', 'annoyance']",delete spam learn punish sigs fucking idiot,How to delete spam : Learn how to punish sigs you fucking idiot,['negative']
"I couldn’t imagine putting a brand new car on these roads, let alone a Tesla.",[10],eexow1r,1,77,15,['disapproval'],imagine putting brand new car roads let alone tesla,"I couldn ’ t imagine putting a brand new car on these roads , let alone a Tesla .",['negative']
That poor janitor.,[25],ef7x9uj,1,18,3,['sadness'],poor janitor,That poor janitor .,['negative']
We all love to read into data without actually reading the data.,[18],ed92uzb,1,64,12,['love'],love read data without actually reading data,We all love to read into data without actually reading the data .,['positive']
Dang this is awesome,[0],ef5x10d,1,20,4,['admiration'],dang awesome,Dang this is awesome,['positive']
ME drunk [NAME] kiss ma girl like,[27],ee4voz6,1,33,7,['neutral'],drunk name kiss girl like,ME drunk [ NAME ] kiss ma girl like,['neutral']
I mean you should stay subbed to Pewds for obvious reasons.,[27],ef7p7xk,1,59,11,['neutral'],mean stay subbed pewds obvious reasons,I mean you should stay subbed to Pewds for obvious reasons .,['neutral']
How are they assholes?,"[2, 3]",ed4b2l1,2,22,4,"['anger', 'annoyance']",assholes,How are they assholes ?,['negative']
"You don't suck, jazz is amazing man. Thanks for a album to listen.","[0, 15]",eeqva4l,2,66,13,"['admiration', 'gratitude']",suck jazz amazing man thanks album listen,"You do n't suck , jazz is amazing man . Thanks for a album to listen .",['positive']
"7) All success, disappointment, and venting posts may only be made as comments in the weekly megathread.",[27],eede8fg,1,104,17,['neutral'],7 success disappointment venting posts may made comments weekly megathread,"7 ) All success , disappointment , and venting posts may only be made as comments in the weekly megathread .",['neutral']
Hoooo boy am I ready for a masterpiece,[13],eev9m7c,1,38,8,['excitement'],hoooo boy ready masterpiece,Hoooo boy am I ready for a masterpiece,['positive']
Probably preschool.,[27],eczll42,1,19,2,['neutral'],probably preschool,Probably preschool .,['neutral']
Yeah that doesn't sound fun at all. I may just stick to the burbs.... Thanks for the reply.,[15],ee7ajre,1,91,18,['gratitude'],yeah sound fun may stick burbs thanks reply,Yeah that does n't sound fun at all . I may just stick to the burbs .... Thanks for the reply .,['positive']
a PG that shoots 41% on free throws? pass. would much rather have jrue if we're shitposting,"[3, 7]",ef9bdmx,2,91,17,"['annoyance', 'curiosity']",pg shoots 41 free throws pass would much rather jrue shitposting,a PG that shoots 41 % on free throws ? pass . would much rather have jrue if we 're shitposting,"['ambiguous', 'negative']"
"I know it's possible, but you have to be wayyyy above average alpha type.",[27],eetbnjm,1,73,14,['neutral'],know possible wayyyy average alpha type,"I know it 's possible , but you have to be wayyyy above average alpha type .",['neutral']
Ahhh makes sense. They were being sarcastic but it went over my head haha. Thank you.,[15],ef26gff,1,85,16,['gratitude'],ahhh makes sense sarcastic went head haha thank,Ahhh makes sense . They were being sarcastic but it went over my head haha . Thank you .,['positive']
whos the killer,[27],ed0pb0j,1,15,3,['neutral'],whos killer,whos the killer,['neutral']
"That's just the adrenaline. It'll set in soon, haha","[17, 27]",eer01eq,2,51,9,"['joy', 'neutral']",adrenaline set soon haha,"That 's just the adrenaline . It 'll set in soon , haha","['neutral', 'positive']"
I appreciate your meme OP.,[0],edcblty,1,26,5,['admiration'],appreciate meme op,I appreciate your meme OP .,['positive']
RemindMe! 3 Days,[27],ef2ot38,1,16,3,['neutral'],remindme 3 days,RemindMe ! 3 Days,['neutral']
I’ve only been there once but really enjoyed it!! But I think it’s missing a pool table ;),"[1, 17]",ee38zkj,2,90,18,"['amusement', 'joy']",really enjoyed think missing pool table,I ’ ve only been there once but really enjoyed it ! ! But I think it ’ s missing a pool table ; ),['positive']
Get a body pillow made of yourself and give it to her as a present when she misses you she can just hug the pillow,[27],eezj3y2,1,114,25,['neutral'],get body pillow made give present misses hug pillow,Get a body pillow made of yourself and give it to her as a present when she misses you she can just hug the pillow,['neutral']
Dont get stuck in deep thought too much or you could loose focus but i have no problem as long as my vision is not impaired.,[27],eezux4i,1,124,26,['neutral'],dont get stuck deep thought much could loose focus problem long vision impaired,Dont get stuck in deep thought too much or you could loose focus but i have no problem as long as my vision is not impaired .,['neutral']
Everyone is a little toxic inside. I feel like killers being toxic comes from survivors being toxic and vice versa. It's a vicious cycle.,[27],ee1r52o,1,137,24,['neutral'],everyone little toxic inside feel like killers toxic comes survivors toxic vice versa vicious cycle,Everyone is a little toxic inside . I feel like killers being toxic comes from survivors being toxic and vice versa . It 's a vicious cycle .,['neutral']
Haha I've never seen a BritSovcit video but now I'm gonna have to check some out,[1],edbc65z,1,80,16,['amusement'],haha never seen britsovcit video gon na check,Haha I 've never seen a BritSovcit video but now I 'm gon na have to check some out,['positive']
So nothing? His office is going to do nothing? Or will the location of the office be a fictional place?,[6],ee85dxp,1,103,20,['confusion'],nothing office going nothing location office fictional place,So nothing ? His office is going to do nothing ? Or will the location of the office be a fictional place ?,['ambiguous']
This franchise has been breaking my heart longer than you've been alive. Awesome.,[0],eesejby,1,81,13,['admiration'],franchise breaking heart longer alive awesome,This franchise has been breaking my heart longer than you 've been alive . Awesome .,['positive']
"Or maybe just cross posting. Or even just saving the picture, reddit does have a handy feature for that. ",[27],eds6zfo,1,105,19,['neutral'],maybe cross posting even saving picture reddit handy feature,"Or maybe just cross posting . Or even just saving the picture , reddit does have a handy feature for that .",['neutral']
"Keep your head straight, stay on your path, and stick to your guns. ",[5],ed31t55,1,68,13,['caring'],keep head straight stay path stick guns,"Keep your head straight , stay on your path , and stick to your guns .",['positive']
*looks through comments* Who said it was going to be unbiased?,[27],ed6vo6l,1,62,11,['neutral'],looks comments said going unbiased,* looks through comments * Who said it was going to be unbiased ?,['neutral']
You are the only person you can depend on,[27],ef3vfco,1,41,9,['neutral'],person depend,You are the only person you can depend on,['neutral']
"Thanks, I love it ","[15, 18]",effrlus,2,18,4,"['gratitude', 'love']",thanks love,"Thanks , I love it",['positive']
Who is this Wild team? Where have they been?,"[6, 7]",edrqtz1,2,44,9,"['confusion', 'curiosity']",wild team,Who is this Wild team ? Where have they been ?,['ambiguous']
NBA is like Westworld only completely opposite. Every time you act like your true self you get a T lol,[1],edf41gg,1,102,20,['amusement'],nba like westworld completely opposite every time act like true self get lol,NBA is like Westworld only completely opposite . Every time you act like your true self you get a T lol,['positive']
She's already promised her kids they can have it and now all four of them are crying!,[27],ednk6hr,1,85,17,['neutral'],already promised kids four crying,She 's already promised her kids they can have it and now all four of them are crying !,['neutral']
We don’t “know” but it was reported he is expected to stay on. Really glad about it,[17],edio7w9,1,83,17,['joy'],know reported expected stay really glad,We don ’ t “ know ” but it was reported he is expected to stay on . Really glad about it,['positive']
Wow thanks. Was hoping to see more exact same moon pics for the eleventy millionth time.,"[15, 20]",ees50n5,2,88,16,"['gratitude', 'optimism']",wow thanks hoping see exact moon pics eleventy millionth time,Wow thanks . Was hoping to see more exact same moon pics for the eleventy millionth time .,['positive']
Honey badger don’t give no fuck!,[27],ef2r1oc,1,32,6,['neutral'],honey badger give fuck,Honey badger don ’ t give no fuck !,['neutral']
"Yes, you should speak with an attorney.","[4, 27]",edradai,2,39,7,"['approval', 'neutral']",yes speak attorney,"Yes , you should speak with an attorney .","['neutral', 'positive']"
So that’s why all of the lab work I get takes so long....,[27],edlycv3,1,57,13,['neutral'],lab work get takes long,So that ’ s why all of the lab work I get takes so long ....,['neutral']
Cake! Happy days!,"[13, 17]",edoaiod,2,17,3,"['excitement', 'joy']",cake happy days,Cake ! Happy days !,['positive']
"""You should have known I was busy...."" or some other sort of nonsense that assumes I knew ahead of time. N's, amiright?",[27],eejlqjz,1,119,22,['neutral'],known busy sort nonsense assumes knew ahead time n amiright,"`` You should have known I was busy .... '' or some other sort of nonsense that assumes I knew ahead of time . N 's , amiright ?",['neutral']
Rules say no identifying information,[10],ef71obj,1,36,5,['disapproval'],rules say identifying information,Rules say no identifying information,['negative']
"I love that! We need a ""We have cookies"" line for her, now!",[18],eerp9gl,1,59,13,['love'],love need cookies line,"I love that ! We need a `` We have cookies '' line for her , now !",['positive']
"A team has to be at least 3 people, right? So 500/3 = $167 a week. Baller CEO status",[27],ee56mcf,1,84,19,['neutral'],team least 3 people right 167 week baller ceo status,"A team has to be at least 3 people , right ? So 500/3 = $ 167 a week . Baller CEO status",['neutral']
By being intellectually dishonest? Ok.,[7],efdpyyt,1,38,5,['curiosity'],intellectually dishonest ok,By being intellectually dishonest ? Ok .,['ambiguous']
Hockey players are more brave than the US Marines. Have you seen how tough they are they are so tough,[0],ednrv41,1,101,20,['admiration'],hockey players brave us marines seen tough tough,Hockey players are more brave than the US Marines . Have you seen how tough they are they are so tough,['positive']
"What a vile, vile country we live in.",[27],edhcejo,1,37,8,['neutral'],vile vile country live,"What a vile , vile country we live in .",['neutral']
"Fantastic read, thanks for the insights! ",[15],eekk36g,1,41,6,['gratitude'],fantastic read thanks insights,"Fantastic read , thanks for the insights !",['positive']
> since he was the one to take it away from [NAME] last season [NAME] didn't deserve it last season,"[10, 27]",eczi4kj,2,99,20,"['disapproval', 'neutral']",since one take away name last season name deserve last season,> since he was the one to take it away from [ NAME ] last season [ NAME ] did n't deserve it last season,"['negative', 'neutral']"
You realize that the ex husband is not related to MGTOW at all right?,"[22, 27]",ef6zbv1,2,69,14,"['realization', 'neutral']",realize ex husband related mgtow right,You realize that the ex husband is not related to MGTOW at all right ?,"['ambiguous', 'neutral']"
Canada is also getting news coverage.,[27],ee8oavw,1,37,6,['neutral'],canada also getting news coverage,Canada is also getting news coverage .,['neutral']
Kids disturb more and are MORE ANNOYING.,[3],edlu2mc,1,40,7,['annoyance'],kids disturb annoying,Kids disturb more and are MORE ANNOYING .,['negative']
"A Visa gift card is a type of Visa card, and you can return money to it just like you can with any other Visa card.",[27],eds5tru,1,115,26,['neutral'],visa gift card type visa card return money like visa card,"A Visa gift card is a type of Visa card , and you can return money to it just like you can with any other Visa card .",['neutral']
You look chunky,[0],ed8i5qv,1,15,3,['admiration'],look chunky,You look chunky,['positive']
"the force awakes wasn't a clear insult, it was just mediocre.",[27],ee90oo4,1,61,11,['neutral'],force awakes clear insult mediocre,"the force awakes was n't a clear insult , it was just mediocre .",['neutral']
"I'm wondering how many players have ""PhD In Punishment"" -comment unironically.",[26],ed55p4p,1,78,11,['surprise'],wondering many players phd punishment unironically,I 'm wondering how many players have `` PhD In Punishment '' -comment unironically .,['ambiguous']
"Here we go, ya'll ready for WW3...this time we're the baddies! ",[13],ee77sou,1,63,11,['excitement'],go ya ready ww3 time baddies,"Here we go , ya 'll ready for WW3 ... this time we 're the baddies !",['positive']
Honestly if you had to live in punchbowl you’d be angry too,[3],ee2yih0,1,59,12,['annoyance'],honestly live punchbowl angry,Honestly if you had to live in punchbowl you ’ d be angry too,['negative']
That seems pretty rough. If I ask Google for directions from white center to Fiona it’s only an hour by bicycle even.,[27],edowgt0,1,117,22,['neutral'],seems pretty rough ask google directions white center fiona hour bicycle even,That seems pretty rough . If I ask Google for directions from white center to Fiona it ’ s only an hour by bicycle even .,['neutral']
I must of not fully understood what you meant... damn tired redditing,"[3, 10]",ef7g5dg,2,69,12,"['annoyance', 'disapproval']",must fully understood meant damn tired redditing,I must of not fully understood what you meant ... damn tired redditing,['negative']
What is TMOR?,[7],ed71z4y,1,13,3,['curiosity'],tmor,What is TMOR ?,['ambiguous']
Macaroni and cheese Beans Bacon Grits Hash browns Maple syrup Imported Tim's coffee Poutine Hawaiian pizza Beaver tail Ketchup and all dressed chips Nanaimo bars Whiskey Craft beer,[27],ee082fo,1,180,28,['neutral'],macaroni cheese beans bacon grits hash browns maple syrup imported tim coffee poutine hawaiian pizza beaver tail ketchup dressed chips nanaimo bars whiskey craft beer,Macaroni and cheese Beans Bacon Grits Hash browns Maple syrup Imported Tim 's coffee Poutine Hawaiian pizza Beaver tail Ketchup and all dressed chips Nanaimo bars Whiskey Craft beer,['neutral']
And I *can* physically drink over 12 beers in a sitting. And my cat *can* physically jump out of the open window if he wanted to. Sigh.,[27],ee16twd,1,135,27,['neutral'],physically drink 12 beers sitting cat physically jump open window wanted sigh,And I * can * physically drink over 12 beers in a sitting . And my cat * can * physically jump out of the open window if he wanted to . Sigh .,['neutral']
I thought he was trolling oops,[12],ee8sgaw,1,30,6,['embarrassment'],thought trolling oops,I thought he was trolling oops,['negative']
Wouldn’t cheddar tear for that joke,[27],ef0cb3j,1,35,6,['neutral'],cheddar tear joke,Wouldn ’ t cheddar tear for that joke,['neutral']
"Nope, try to keep up.",[5],ed622jn,1,21,5,['caring'],nope try keep,"Nope , try to keep up .",['positive']
I can't tell if the is comfortable in that outfit,[6],ees6s9p,1,49,10,['confusion'],ca tell comfortable outfit,I ca n't tell if the is comfortable in that outfit,['ambiguous']
Are you [NAME]?,[7],eeda3xf,1,15,3,['curiosity'],name,Are you [ NAME ] ?,['ambiguous']
Phew. We can safely disregard anything he says then. I thought he might be talking about another EU referendum. Cheers!,[27],edp891y,1,119,20,['neutral'],phew safely disregard anything says thought might talking another eu referendum cheers,Phew . We can safely disregard anything he says then . I thought he might be talking about another EU referendum . Cheers !,['neutral']
"So glad you are safe. It looks like icy conditions, too, so that is great that you were able to avoid this.","[5, 15, 23]",edmd0et,3,107,22,"['caring', 'gratitude', 'relief']",glad safe looks like icy conditions great able avoid,"So glad you are safe . It looks like icy conditions , too , so that is great that you were able to avoid this .",['positive']
Thats even worse than what you put up (no offense really). Your work is well done just a hideous design.,[0],ee2vy9d,1,104,20,['admiration'],thats even worse put offense really work well done hideous design,Thats even worse than what you put up ( no offense really ) . Your work is well done just a hideous design .,['positive']
I really don't think healthy people with no other emotional issues regret having their kids.,[25],eenar60,1,92,15,['sadness'],really think healthy people emotional issues regret kids,I really do n't think healthy people with no other emotional issues regret having their kids .,['negative']
"Thank you, this is genuinely helpful. ",[15],eegwjtk,1,38,6,['gratitude'],thank genuinely helpful,"Thank you , this is genuinely helpful .",['positive']
That’s funny cause in the movies subreddit everyone was happy about black panther because of skin color.,[4],edc9skh,1,104,17,['approval'],funny cause movies subreddit everyone happy black panther skin color,That ’ s funny cause in the movies subreddit everyone was happy about black panther because of skin color .,['positive']
I get snuck up on by my papillon I wouldn't stand a chance against an actual predator,[27],ee6orc8,1,85,17,['neutral'],get snuck papillon would stand chance actual predator,I get snuck up on by my papillon I would n't stand a chance against an actual predator,['neutral']
He's mainly on Twitch now. Before I unfollowed him some time ago he did some YT content from time to time.,[22],eej2v2d,1,106,21,['realization'],mainly twitch unfollowed time ago yt content time time,He 's mainly on Twitch now . Before I unfollowed him some time ago he did some YT content from time to time .,['ambiguous']
Jewel mint by Pod Juice for sure is the closest thing to mint pods. Don't know anyone who has replicated menthol yet.,[7],efdirtb,1,117,22,['curiosity'],jewel mint pod juice sure closest thing mint pods know anyone replicated menthol yet,Jewel mint by Pod Juice for sure is the closest thing to mint pods . Do n't know anyone who has replicated menthol yet .,['ambiguous']
[NAME]: I have a plan. Me: You’ve always got a damn plan ̶D̶u̶t̶c̶h̶ [NAME].,[3],edrau51,1,76,14,['annoyance'],name plan always got damn plan name,[ NAME ] : I have a plan . Me : You ’ ve always got a damn plan ̶D̶u̶t̶c̶h̶ [ NAME ] .,['negative']
Too much time am running for it,[27],ef2lmn0,1,31,7,['neutral'],much time running,Too much time am running for it,['neutral']
I'd say the pecans is the biggest mistake,[3],eetbxhz,1,41,8,['annoyance'],say pecans biggest mistake,I 'd say the pecans is the biggest mistake,['negative']
yeah he was a good defender in Utah,[0],ef4vtyk,1,35,8,['admiration'],yeah good defender utah,yeah he was a good defender in Utah,['positive']
Strawberry lemonade by ziip pods is the best I've ever tasted.,[0],ef2j5zn,1,62,11,['admiration'],strawberry lemonade ziip pods best ever tasted,Strawberry lemonade by ziip pods is the best I 've ever tasted .,['positive']
Interesting indeed 😕,"[4, 7]",eeereq2,2,20,3,"['approval', 'curiosity']",interesting indeed,Interesting indeed 😕,"['ambiguous', 'positive']"
I absolutely did and loved every minute of it. I really do hope it gets more seasons,"[18, 20]",editlgc,2,84,17,"['love', 'optimism']",absolutely loved every minute really hope gets seasons,I absolutely did and loved every minute of it . I really do hope it gets more seasons,['positive']
"I moved here a year ago, this is the second time I've seen a flipped car in this sub",[27],edfh4i7,1,84,19,['neutral'],moved year ago second time seen flipped car sub,"I moved here a year ago , this is the second time I 've seen a flipped car in this sub",['neutral']
