text,labels,id,num_labels,char_len,word_len,label_names,text_clean_tfidf,text_clean_transformer,grouped_labels
"53 months?? That is insane, must've been a different type of octopus then the one I was learning about. ","[7, 26]",ee3zmb9,2,104,19,"['curiosity', 'surprise']",53 months insane must different type octopus one learning,"53 months ? ? That is insane , must 've been a different type of octopus then the one I was learning about .",['ambiguous']
Thanks! There are so many resources available. Thank you for telling me about one that actually helped you,[15],efh5j4f,1,106,18,['gratitude'],thanks many resources available thank telling one actually helped,Thanks ! There are so many resources available . Thank you for telling me about one that actually helped you,['positive']
This happens in America as well. Unfortunately the news cycle isn't interested in reporting such things. Just doom and gloom.,[27],een8eey,1,125,20,['neutral'],happens america well unfortunately news cycle interested reporting things doom gloom,This happens in America as well . Unfortunately the news cycle is n't interested in reporting such things . Just doom and gloom .,['neutral']
I thought the sane until I got threatening emails from HR,[22],eew1vsp,1,57,11,['realization'],thought sane got threatening emails hr,I thought the sane until I got threatening emails from HR,['ambiguous']
Out of control by darude. Just get carried away by the sounds man,[27],ef1q97v,1,65,13,['neutral'],control darude get carried away sounds man,Out of control by darude . Just get carried away by the sounds man,['neutral']
We might just sleep on an air mattress while we wait 😂 awe that’s so sweet of you!! We love our bunnies and veggies haha,[18],ed4vcgt,1,120,25,['love'],might sleep air mattress wait awe sweet love bunnies veggies haha,We might just sleep on an air mattress while we wait 😂 awe that ’ s so sweet of you ! ! We love our bunnies and veggies haha,['positive']
the best places are immigrant restaurants. cheap and delicious food. the better ones are outside of downtown.,[0],efa2qrc,1,109,17,['admiration'],best places immigrant restaurants cheap delicious food better ones outside downtown,the best places are immigrant restaurants . cheap and delicious food . the better ones are outside of downtown .,['positive']
"Not even surprised by rudi, the man has been a beast since we got him.",[21],edh0w1s,1,70,15,['pride'],even surprised rudi man beast since got,"Not even surprised by rudi , the man has been a beast since we got him .",['positive']
Their orange chicken is the absolute fucking bomb. I love having it on top of a nice bed of rice and veggies :D,[18],edgfizd,1,111,23,['love'],orange chicken absolute fucking bomb love top nice bed rice veggies,Their orange chicken is the absolute fucking bomb . I love having it on top of a nice bed of rice and veggies : D,['positive']
You have no idea what you're talking about.,[27],eesg1is,1,43,8,['neutral'],idea talking,You have no idea what you 're talking about .,['neutral']
I guess you were hoping for love from someone who is not well enough to offer love.,[20],eebelmt,1,83,17,['optimism'],guess hoping love someone well enough offer love,I guess you were hoping for love from someone who is not well enough to offer love .,['positive']
source:,[27],eerdvws,1,7,1,['neutral'],source,source :,['neutral']
It would feel amazing. Which would scare you. So you would crush it. Along with yourself.,[0],eebahnj,1,89,16,['admiration'],would feel amazing would scare would crush along,It would feel amazing . Which would scare you . So you would crush it . Along with yourself .,['positive']
Too bad they lost.,[9],ed6lzu6,1,18,4,['disappointment'],bad lost,Too bad they lost .,['negative']
I don’t think [NAME] knocking us out of the copa would change anything. Our team is incredibly lethargic.,"[9, 10]",ee81jna,2,105,18,"['disappointment', 'disapproval']",think name knocking us copa would change anything team incredibly lethargic,I don ’ t think [ NAME ] knocking us out of the copa would change anything . Our team is incredibly lethargic .,['negative']
Find a new doctor. If he isn't willing to treat people because of political affiliation then he's a horrible doctor and an even worse person.,[2],eelqrny,1,141,25,['anger'],find new doctor willing treat people political affiliation horrible doctor even worse person,Find a new doctor . If he is n't willing to treat people because of political affiliation then he 's a horrible doctor and an even worse person .,['negative']
"Hey, good to see ya here!",[17],eecaba4,1,25,6,['joy'],hey good see ya,"Hey , good to see ya here !",['positive']
"Nice, congrats!","[0, 15]",efejs5t,2,15,2,"['admiration', 'gratitude']",nice congrats,"Nice , congrats !",['positive']
They prefer the term pro-life instead of anti-choice. Unless you want to be anti-life,[27],ef3z01r,1,85,14,['neutral'],prefer term instead unless want,They prefer the term pro-life instead of anti-choice . Unless you want to be anti-life,['neutral']
That's not fickle. That's insane and delusional. It's not some cute little quirk. It's a disconnect with reality.,[10],ef7a6pm,1,113,18,['disapproval'],fickle insane delusional cute little quirk disconnect reality,That 's not fickle . That 's insane and delusional . It 's not some cute little quirk . It 's a disconnect with reality .,['negative']
I like TRTL.,[18],ef0c0w7,1,12,3,['love'],like trtl,I like TRTL .,['positive']
I finished high school back in 2010 friend but yes good luck to me for the weekend 😎,"[4, 20]",ed3d31z,2,84,18,"['approval', 'optimism']",finished high school back 2010 friend yes good luck weekend,I finished high school back in 2010 friend but yes good luck to me for the weekend 😎,['positive']
Calling people on the internet “sweetie”... sweet [NAME] I love this sub. The cringe hurts so good.,"[18, 27]",eenofkg,2,99,17,"['love', 'neutral']",calling people internet sweetie sweet name love sub cringe hurts good,Calling people on the internet “ sweetie ” ... sweet [ NAME ] I love this sub . The cringe hurts so good .,"['neutral', 'positive']"
You said it wrong.,[10],ed890o9,1,18,4,['disapproval'],said wrong,You said it wrong .,['negative']
Maybe Streamlight Strion if OP wants something Fenix PD35 sized? Havent used one myself but have heard good things.,[0],ee4g4k6,1,115,19,['admiration'],maybe streamlight strion op wants something fenix pd35 sized havent used one heard good things,Maybe Streamlight Strion if OP wants something Fenix PD35 sized ? Havent used one myself but have heard good things .,['positive']
She didn't hit any of the notes but I still love [NAME] so much.,[18],ed1zou9,1,64,14,['love'],hit notes still love name much,She did n't hit any of the notes but I still love [ NAME ] so much .,['positive']
"The Sephardic Temple in my area offers traditional non-equalitarian services, so it’s not an official Sephardic synagogue?","[6, 27]",eeg4uci,2,122,17,"['confusion', 'neutral']",sephardic temple area offers traditional services official sephardic synagogue,"The Sephardic Temple in my area offers traditional non-equalitarian services , so it ’ s not an official Sephardic synagogue ?","['ambiguous', 'neutral']"
Oh and my heart is starting to back a little spastic but easy to control,[27],edlm9eb,1,72,15,['neutral'],oh heart starting back little spastic easy control,Oh and my heart is starting to back a little spastic but easy to control,['neutral']
"its great that she takes care of you, but remember to let her know that she can lean on you",[0],eep3xik,1,91,20,['admiration'],great takes care remember let know lean,"its great that she takes care of you , but remember to let her know that she can lean on you",['positive']
I think you're confused I'm asking for upvote posts of women complaining that men are bad. Not men complaining about women.,[27],edqjn7t,1,123,21,['neutral'],think confused asking upvote posts women complaining men bad men complaining women,I think you 're confused I 'm asking for upvote posts of women complaining that men are bad . Not men complaining about women .,['neutral']
yeah u can have them both!,[27],ee5hdu8,1,26,6,['neutral'],yeah u,yeah u can have them both !,['neutral']
But your comparing [NAME] to harden and curry. That’s how you know simply comparing 3 pt % doesn’t tell you the full story.,[27],edrw0tf,1,123,23,['neutral'],comparing name harden curry know simply comparing 3 pt tell full story,But your comparing [ NAME ] to harden and curry . That ’ s how you know simply comparing 3 pt % doesn ’ t tell you the full story .,['neutral']
>who accused him and [NAME] of raping her then did a porno where she fucked both of them AND [NAME]? She did?,[7],ef8ox47,1,109,22,['curiosity'],accused name raping porno fucked name,> who accused him and [ NAME ] of raping her then did a porno where she fucked both of them AND [ NAME ] ? She did ?,['ambiguous']
I just hurked a little in my mouth.,[27],eczmlkj,1,35,8,['neutral'],hurked little mouth,I just hurked a little in my mouth .,['neutral']
What's he building in there?,[7],eeqwnix,1,28,5,['curiosity'],building,What 's he building in there ?,['ambiguous']
"Hence what I said, it is just as illegal yesterday as it is today ... literally nothing changed ",[10],ee6hone,1,96,18,['disapproval'],hence said illegal yesterday today literally nothing changed,"Hence what I said , it is just as illegal yesterday as it is today ... literally nothing changed",['negative']
"NOLA is a terrible place to live, ran by democrats forever and this is the result. ",[10],ed3pn0k,1,83,16,['disapproval'],nola terrible place live ran democrats forever result,"NOLA is a terrible place to live , ran by democrats forever and this is the result .",['negative']
Argentina is with you! Be strong comrades!,"[4, 5]",edxy0ke,2,42,7,"['approval', 'caring']",argentina strong comrades,Argentina is with you ! Be strong comrades !,['positive']
Holy shit it's almost like the PYD is a organization of Syrian citizens I can't believe he exposed them on that.,[3],ed92zjj,1,112,21,['annoyance'],holy shit almost like pyd organization syrian citizens ca believe exposed,Holy shit it 's almost like the PYD is a organization of Syrian citizens I ca n't believe he exposed them on that .,['negative']
"The Beatles weren't even close to being ""in the past"" when they broke up.",[27],ee18yk0,1,73,14,['neutral'],beatles even close past broke,The Beatles were n't even close to being `` in the past '' when they broke up .,['neutral']
Hey everybody we got us an optimist here.,[20],edorxks,1,41,8,['optimism'],hey everybody got us optimist,Hey everybody we got us an optimist here .,['positive']
I'm slippery,[27],ef4sk1n,1,12,2,['neutral'],slippery,I 'm slippery,['neutral']
NO BOY! NO MORE FREEDOMS TO GO AROUND HERE! Now go back to your room and give me your toy guns immediately,[2],edukdhx,1,106,22,['anger'],boy freedoms go around go back room give toy guns immediately,NO BOY ! NO MORE FREEDOMS TO GO AROUND HERE ! Now go back to your room and give me your toy guns immediately,['negative']
Your idea of what a nice entre or nice wine cost at a restaurant are... Interesting....,[0],edg84ip,1,87,16,['admiration'],idea nice entre nice wine cost restaurant interesting,Your idea of what a nice entre or nice wine cost at a restaurant are ... Interesting ....,['positive']
You can replace the ram / SSD now on the new Razer blade 15 but ya razer sucks.,[27],ed1rnvi,1,79,18,['neutral'],replace ram ssd new razer blade 15 ya razer sucks,You can replace the ram / SSD now on the new Razer blade 15 but ya razer sucks .,['neutral']
Real life Troll doll,[27],edqjdel,1,20,4,['neutral'],real life troll doll,Real life Troll doll,['neutral']
"I just saw the same, apparently she upheld her views in a 2016 interview. ",[27],edxrrce,1,74,14,['neutral'],saw apparently upheld views 2016 interview,"I just saw the same , apparently she upheld her views in a 2016 interview .",['neutral']
"thank [NAME] that period is over, pretty sure the lightning had like -89 shots that period",[23],edls8y5,1,90,16,['relief'],thank name period pretty sure lightning like shots period,"thank [ NAME ] that period is over , pretty sure the lightning had like -89 shots that period",['positive']
"Crisis centers are not only for battered women they are for abused women as well. From the looks of it, they are all abusing you. ",[10],edmupsj,1,130,25,['disapproval'],crisis centers battered women abused women well looks abusing,"Crisis centers are not only for battered women they are for abused women as well . From the looks of it , they are all abusing you .",['negative']
"[NAME] maybe next year,i didn't think she was gonna win but hope she gets in the top 30 by the end",[27],eewfcok,1,98,21,['neutral'],name maybe next year think gon na win hope gets top 30 end,"[ NAME ] maybe next year , i did n't think she was gon na win but hope she gets in the top 30 by the end",['neutral']
"You poop into my butt, then I poop it back into your butt...",[27],efcj4iy,1,60,13,['neutral'],poop butt poop back butt,"You poop into my butt , then I poop it back into your butt ...",['neutral']
"Ah. Yea, the classic loner looking for compliments. Seems pretty edgy",[0],ed3sqoq,1,69,11,['admiration'],ah yea classic loner looking compliments seems pretty edgy,"Ah . Yea , the classic loner looking for compliments . Seems pretty edgy",['positive']
"Teacher: Huh, I never though he'd really do that.",[9],eetonhn,1,49,9,['disappointment'],teacher huh never though really,"Teacher : Huh , I never though he 'd really do that .",['negative']
They aren’t really being choosy.,[27],effyr06,1,32,5,['neutral'],really choosy,They aren ’ t really being choosy .,['neutral']
The best for a reason.,[4],ed64x5d,1,22,5,['approval'],best reason,The best for a reason .,['positive']
This is the greatest analogy,[0],efalecb,1,28,5,['admiration'],greatest analogy,This is the greatest analogy,['positive']
Congrats and good luck moving forward!,[0],eea0xl0,1,38,6,['admiration'],congrats good luck moving forward,Congrats and good luck moving forward !,['positive']
I do that with my boyfriend. We can room together on school field trips and sleep at each other’s houses without suspicion. I love it,[18],ed4tq85,1,133,25,['love'],boyfriend room together school field trips sleep houses without suspicion love,I do that with my boyfriend . We can room together on school field trips and sleep at each other ’ s houses without suspicion . I love it,['positive']
Damn its like that tv show on Netflix called You. Stay safe and hope everything works out for you.,[5],edplox2,1,98,19,['caring'],damn like tv show netflix called stay safe hope everything works,Damn its like that tv show on Netflix called You . Stay safe and hope everything works out for you .,['positive']
I love this post so much. Really drives the point home and made me laugh!,"[1, 18]",ee8hd4k,2,73,15,"['amusement', 'love']",love post much really drives point home made laugh,I love this post so much . Really drives the point home and made me laugh !,['positive']
I'm pretty sure she wants to be alone with you,[4],ed797tj,1,46,10,['approval'],pretty sure wants alone,I 'm pretty sure she wants to be alone with you,['positive']
"Thanks dude! I do best with the ice, swat and maddox",[15],edfthgb,1,52,11,['gratitude'],thanks dude best ice swat maddox,"Thanks dude ! I do best with the ice , swat and maddox",['positive']
Looks like a hover hand for a few frames.,[27],ed1qgl8,1,41,9,['neutral'],looks like hover hand frames,Looks like a hover hand for a few frames .,['neutral']
This is disgusting.,[11],edqf29n,1,19,3,['disgust'],disgusting,This is disgusting .,['negative']
What do you mean,[6],eeshn8p,1,16,4,['confusion'],mean,What do you mean,['ambiguous']
france drinks coffe from a bowl.,[27],edi44kn,1,32,6,['neutral'],france drinks coffe bowl,france drinks coffe from a bowl .,['neutral']
"Stop eating 3,000 calories a meal?",[27],eeaxk1x,1,34,6,['neutral'],stop eating calories meal,"Stop eating 3,000 calories a meal ?",['neutral']
May i have joke I can't find it,[1],edywvc7,1,31,8,['amusement'],may joke ca find,May i have joke I ca n't find it,['positive']
"You didn't write that very clearly at all. I Wish You Would is a cover anyway, and I highly doubt that was the point of the tweet.",[27],ef1rlcr,1,130,27,['neutral'],write clearly wish would cover anyway highly doubt point tweet,"You did n't write that very clearly at all . I Wish You Would is a cover anyway , and I highly doubt that was the point of the tweet .",['neutral']
"""No known gold medals""",[27],eeeioa4,1,22,4,['neutral'],known gold medals,`` No known gold medals '',['neutral']
I can't believe he told that story. I'm sure the minister that released the water is now so totally regretting not asking for a bj!,[26],efapeti,1,131,25,['surprise'],ca believe told story sure minister released water totally regretting asking bj,I ca n't believe he told that story . I 'm sure the minister that released the water is now so totally regretting not asking for a bj !,['ambiguous']
Oh come on! Stop posting this stuff. FFS will you think of my blood pressure!? You’re killing me (figuratively speaking).,[2],efg4e6i,1,121,20,['anger'],oh come stop posting stuff ffs think blood pressure killing figuratively speaking,Oh come on ! Stop posting this stuff . FFS will you think of my blood pressure ! ? You ’ re killing me ( figuratively speaking ) .,['negative']
You’ll know it’s true love when he proposals you after 5 days.,"[5, 18]",ef33bmt,2,62,12,"['caring', 'love']",know true love proposals 5 days,You ’ ll know it ’ s true love when he proposals you after 5 days .,['positive']
True but I think we should be able to strike a deal for less than 50-60m which is worth it in today's market imo,[20],ef4b88t,1,112,24,['optimism'],true think able strike deal less worth today market imo,True but I think we should be able to strike a deal for less than 50-60m which is worth it in today 's market imo,['positive']
But how late is too late?,[7],ee7ps25,1,25,6,['curiosity'],late late,But how late is too late ?,['ambiguous']
I wanted to know if there’s was another like meaning to the whole selfie thing not if she liked me or not,[7],edb267t,1,105,22,['curiosity'],wanted know another like meaning whole selfie thing liked,I wanted to know if there ’ s was another like meaning to the whole selfie thing not if she liked me or not,['ambiguous']
It's probably because your posts are extremely dumb and bigoted,[3],ed8zsq3,1,63,10,['annoyance'],probably posts extremely dumb bigoted,It 's probably because your posts are extremely dumb and bigoted,['negative']
"Visit Texas, or come to AZ. Then you’ll understand.",[27],edowc0f,1,51,9,['neutral'],visit texas come az understand,"Visit Texas , or come to AZ . Then you ’ ll understand .",['neutral']
I hope your relationships are no longer abusive either physically or emotionally.,[27],eead55w,1,81,12,['neutral'],hope relationships longer abusive either physically emotionally,I hope your relationships are no longer abusive either physically or emotionally .,['neutral']
Every one hates him so your just bragging you hate him too to be cool . Its not a confession unless u say something u regret,[3],efavxjp,1,124,26,['annoyance'],every one hates bragging hate cool confession unless u say something u regret,Every one hates him so your just bragging you hate him too to be cool . Its not a confession unless u say something u regret,['negative']
Yeah no haha. Out of my price range tbh,[1],edf3r0o,1,39,9,['amusement'],yeah haha price range tbh,Yeah no haha . Out of my price range tbh,['positive']
it’s a sensitive topic and she probably took it as if smelling bad lol. i’d just avoid saying that,[1],ed24wb0,1,98,19,['amusement'],sensitive topic probably took smelling bad lol avoid saying,it ’ s a sensitive topic and she probably took it as if smelling bad lol . i ’ d just avoid saying that,['positive']
Guess there is no benefit for my next car to be any safer considering I haven’t died in my old one then...,[27],eem5z5l,1,106,22,['neutral'],guess benefit next car safer considering died old one,Guess there is no benefit for my next car to be any safer considering I haven ’ t died in my old one then ...,['neutral']
Head is cold because lack of volume blood flow up there.... (I have a beard!),[27],eeuq3dr,1,77,15,['neutral'],head cold lack volume blood flow beard,Head is cold because lack of volume blood flow up there .... ( I have a beard ! ),['neutral']
What a confession! Unbelievable!,"[0, 26]",ed0cpch,2,32,4,"['admiration', 'surprise']",confession unbelievable,What a confession ! Unbelievable !,"['ambiguous', 'positive']"
"Sure you can, but the question is whether or not the kid will listen, or if you will upset the parent. ","[9, 27]",ed1hy87,2,103,21,"['disappointment', 'neutral']",sure question whether kid listen upset parent,"Sure you can , but the question is whether or not the kid will listen , or if you will upset the parent .","['negative', 'neutral']"
Stay away from the sub till then ahaha,"[1, 3]",ee3l1ba,2,38,8,"['amusement', 'annoyance']",stay away sub till ahaha,Stay away from the sub till then ahaha,"['negative', 'positive']"
"Eh, Level 7 is pretty serious. Give me my Massif and I'll survive anything.",[3],eeuf8yg,1,75,14,['annoyance'],eh level 7 pretty serious give massif survive anything,"Eh , Level 7 is pretty serious . Give me my Massif and I 'll survive anything .",['negative']
"Thank you, I will def look that up. ",[15],edb6mnu,1,36,8,['gratitude'],thank def look,"Thank you , I will def look that up .",['positive']
Would you give your used underwear to your best friend/romantic interest? >!I know I have.!<,[7],eeb5xz0,1,92,15,['curiosity'],would give used underwear best interest know,Would you give your used underwear to your best friend/romantic interest ? > ! I know I have . ! <,['ambiguous']
For your is the First president to impose an audit on the DOD....... This Never happen.,[27],edtth24,1,87,16,['neutral'],first president impose audit dod never happen,For your is the First president to impose an audit on the DOD ....... This Never happen .,['neutral']
Awesome! I'd love to see some if you ever post pics :),"[0, 18]",edmf7fe,2,54,12,"['admiration', 'love']",awesome love see ever post pics,Awesome ! I 'd love to see some if you ever post pics : ),['positive']
"No, it was believed that the baby absorbed maternal traits because the mother was the ""soil"" the ""seed"" grew in. ",[10],eebeui2,1,113,20,['disapproval'],believed baby absorbed maternal traits mother soil seed grew,"No , it was believed that the baby absorbed maternal traits because the mother was the `` soil '' the `` seed '' grew in .",['negative']
Love the place but be ready to wait. They really do take the time to make sure you look good and fresh.,"[0, 18]",ee39naw,2,103,22,"['admiration', 'love']",love place ready wait really take time make sure look good fresh,Love the place but be ready to wait . They really do take the time to make sure you look good and fresh .,['positive']
"Yeah. All they have to do is ask for absolution, which means [NAME] can live a life of sin and repent and go to their heaven.",[22],efbu7hq,1,125,26,['realization'],yeah ask absolution means name live life sin repent go heaven,"Yeah . All they have to do is ask for absolution , which means [ NAME ] can live a life of sin and repent and go to their heaven .",['ambiguous']
You're in for a treat- enjoy :),[17],ed8ei53,1,31,7,['joy'],enjoy,You 're in for a treat- enjoy : ),['positive']
That's really good!,[0],eemgibr,1,19,3,['admiration'],really good,That 's really good !,['positive']
"No, a plot hole means that your story lacks logical consistency ",[10],ef99bzg,1,64,11,['disapproval'],plot hole means story lacks logical consistency,"No , a plot hole means that your story lacks logical consistency",['negative']
[NAME] has said he's giving it over to [NAME] for about 5 minutes now,[27],ednvm2k,1,69,14,['neutral'],name said giving name 5 minutes,[ NAME ] has said he 's giving it over to [ NAME ] for about 5 minutes now,['neutral']
What about Post Morty?,[27],edrxucy,1,22,4,['neutral'],post morty,What about Post Morty ?,['neutral']
He dresses that way in real life...perfect,[27],ef90jxm,1,42,7,['neutral'],dresses way real life perfect,He dresses that way in real life ... perfect,['neutral']
The temperatures in Oymyakon must have slowed down that GIF,[27],edx68cl,1,59,10,['neutral'],temperatures oymyakon must slowed gif,The temperatures in Oymyakon must have slowed down that GIF,['neutral']
I reccomend the lego movie!,[4],eeb9m4v,1,27,5,['approval'],reccomend lego movie,I reccomend the lego movie !,['positive']
Some people just don't understand humor. Imagine living your life like that!,[20],edas5hz,1,76,12,['optimism'],people understand humor imagine living life like,Some people just do n't understand humor . Imagine living your life like that !,['positive']
PLEASE!!! That’s on a PERFECT day! I live here. Trust me. NOT always that simple!,"[0, 10, 13]",efbl1o4,3,81,15,"['admiration', 'disapproval', 'excitement']",please perfect day live trust always simple,PLEASE ! ! ! That ’ s on a PERFECT day ! I live here . Trust me . NOT always that simple !,"['negative', 'positive']"
also a harsh NOOOO when disgusted,[11],edunxri,1,33,6,['disgust'],also harsh noooo disgusted,also a harsh NOOOO when disgusted,['negative']
"I want to get rough with him. Choking, tying me up, light BDSM.",[8],ef7vgkm,1,63,13,['desire'],want get rough choking tying light bdsm,"I want to get rough with him . Choking , tying me up , light BDSM .",['positive']
