text,labels,id,num_labels,char_len,word_len,label_names,text_clean_tfidf,text_clean_transformer,grouped_labels
It's a photograph with one of our greatest ever defender and captain. What's your problem?,[2],ede1ek4,1,90,15,['anger'],photograph one greatest ever defender captain problem,It 's a photograph with one of our greatest ever defender and captain . What 's your problem ?,['negative']
That was informative. Thank you.,[15],eed72tk,1,32,5,['gratitude'],informative thank,That was informative . Thank you .,['positive']
Struggling to find :(,"[9, 25]",eewa2ki,2,21,4,"['disappointment', 'sadness']",struggling find,Struggling to find : (,['negative']
should've rolled into battle with a sword brad. that would have fuckin' rocked,"[2, 27]",edab1l1,2,78,13,"['anger', 'neutral']",rolled battle sword brad would fuckin rocked,should 've rolled into battle with a sword brad . that would have fuckin ' rocked,"['negative', 'neutral']"
"Agree. Not a perfect coach but pretty, pretty good ",[0],edyfs82,1,51,9,['admiration'],agree perfect coach pretty pretty good,"Agree . Not a perfect coach but pretty , pretty good",['positive']
Far more to do with being entirely irresponsible and dumb than anything related to benefits or tax claims.,[9],edckbco,1,106,18,['disappointment'],far entirely irresponsible dumb anything related benefits tax claims,Far more to do with being entirely irresponsible and dumb than anything related to benefits or tax claims .,['negative']
Listen to it while you're sad,[5],edrjejz,1,29,6,['caring'],listen sad,Listen to it while you 're sad,['positive']
They 'let themselves go' because they have to pick up the slack of their husband in the household and don't have time for gym/healthy meal planning anymore.,[27],ee766f9,1,156,27,['neutral'],go pick slack husband household time meal planning anymore,They 'let themselves go ' because they have to pick up the slack of their husband in the household and do n't have time for gym/healthy meal planning anymore .,['neutral']
Best kiki dance I’ve ever seen,[0],eemwcl9,1,30,6,['admiration'],best kiki dance ever seen,Best kiki dance I ’ ve ever seen,['positive']
You just going into the posse menu and buy the persistent posse. It costs $200. Good luck ❤️,[4],edflkj4,1,92,18,['approval'],going posse menu buy persistent posse costs 200 good luck,You just going into the posse menu and buy the persistent posse . It costs $ 200 . Good luck ❤️,['positive']
Fair enough. The cake is definitely too much haha,"[1, 4]",eerdz04,2,49,9,"['amusement', 'approval']",fair enough cake definitely much haha,Fair enough . The cake is definitely too much haha,['positive']
I could honestly just go without intermission interviews altogether.,[4],eebrmus,1,68,9,['approval'],could honestly go without intermission interviews altogether,I could honestly just go without intermission interviews altogether .,['positive']
ITS TO THE POINT WHERE I LOVE AND I HATE YOU,[2],ed8d99v,1,44,11,['anger'],point love hate,ITS TO THE POINT WHERE I LOVE AND I HATE YOU,['negative']
"I completely agree, I just think there is more of a chance of Clowney getting tagged than [NAME] getting tagged a second time.",[4],edek6fz,1,126,23,['approval'],completely agree think chance clowney getting tagged name getting tagged second time,"I completely agree , I just think there is more of a chance of Clowney getting tagged than [ NAME ] getting tagged a second time .",['positive']
"That's the best thing about free will, you don't need an excuse.","[0, 4]",eeoh5uj,2,64,12,"['admiration', 'approval']",best thing free need excuse,"That 's the best thing about free will , you do n't need an excuse .",['positive']
Actually yes the left does need to earn my loyalty if they want me to keep voting for them,"[4, 27]",een2q2i,2,90,19,"['approval', 'neutral']",actually yes left need earn loyalty want keep voting,Actually yes the left does need to earn my loyalty if they want me to keep voting for them,"['neutral', 'positive']"
Lol same actually,[1],eeaqur5,1,17,3,['amusement'],lol actually,Lol same actually,['positive']
"Your Beauty shines out of you, than you for this lovely post.",[0],ed7vysr,1,61,12,['admiration'],beauty shines lovely post,"Your Beauty shines out of you , than you for this lovely post .",['positive']
"My anger, up 50%. ",[2],eelnpbh,1,18,4,['anger'],anger 50,"My anger , up 50 % .",['negative']
I had this one! he was a precious little angel and I loved him.,[18],ed214is,1,63,14,['love'],one precious little angel loved,I had this one ! he was a precious little angel and I loved him .,['positive']
Can’t wait to see my IG page blow up with it smh,[7],edjfqic,1,48,12,['curiosity'],wait see ig page blow smh,Can ’ t wait to see my IG page blow up with it smh,['ambiguous']
How? They don't have SoundCloud or anything and it's usually played before you're killed.,[27],ed6tkz3,1,89,14,['neutral'],soundcloud anything usually played killed,How ? They do n't have SoundCloud or anything and it 's usually played before you 're killed .,['neutral']
"Mmmm, I sure do love some Vaseline on a hot piece of toast in the morning. ",[18],eddp6k5,1,75,16,['love'],mmmm sure love vaseline hot piece toast morning,"Mmmm , I sure do love some Vaseline on a hot piece of toast in the morning .",['positive']
Plus like why would they go for the head? You’d have to break both of his legs to stop [NAME].,[27],ednjua6,1,94,20,['neutral'],plus like would go head break legs stop name,Plus like why would they go for the head ? You ’ d have to break both of his legs to stop [ NAME ] .,['neutral']
"I have a feeling [NAME] wasn't innocent in that fight. Not that it's ok, but I instigated shit too. They are on drugs.",[27],eczna0k,1,118,23,['neutral'],feeling name innocent fight ok instigated shit drugs,"I have a feeling [ NAME ] was n't innocent in that fight . Not that it 's ok , but I instigated shit too . They are on drugs .",['neutral']
I like to think [NAME] is finishing the school year before coming back home.,[18],ef82dk7,1,76,14,['love'],like think name finishing school year coming back home,I like to think [ NAME ] is finishing the school year before coming back home .,['positive']
Can’t tell if that’s weird or like nice of you?,[6],ee0rrom,1,47,10,['confusion'],tell weird like nice,Can ’ t tell if that ’ s weird or like nice of you ?,['ambiguous']
"As I understand it, the director? left so at least if they do reboot it it’ll be in more competent hands lol",[1],ed5tyie,1,108,22,['amusement'],understand director left least reboot competent hands lol,"As I understand it , the director ? left so at least if they do reboot it it ’ ll be in more competent hands lol",['positive']
Happy to- good luck!,"[0, 13]",edrz3y4,2,20,4,"['admiration', 'excitement']",happy good luck,Happy to- good luck !,['positive']
"they both rugged, worn, and wrinkled, like fine leather !","[0, 27]",eek9yan,2,57,10,"['admiration', 'neutral']",rugged worn wrinkled like fine leather,"they both rugged , worn , and wrinkled , like fine leather !","['neutral', 'positive']"
"Gorgeous cats, poor babies",[0],eezniuu,1,26,4,['admiration'],gorgeous cats poor babies,"Gorgeous cats , poor babies",['positive']
I never saw this tweet. That just about clears it up then,[27],edr3xq2,1,57,12,['neutral'],never saw tweet clears,I never saw this tweet . That just about clears it up then,['neutral']
He’s just tired and needs to rest.,[5],eex6qby,1,34,7,['caring'],tired needs rest,He ’ s just tired and needs to rest .,['positive']
"That game was great. THOT, be gone...",[0],ee0nzw1,1,37,7,['admiration'],game great thot gone,"That game was great . THOT , be gone ...",['positive']
You would know if you weren't such a Filthy Ricefield Peasant.,[11],edijf4l,1,62,11,['disgust'],would know filthy ricefield peasant,You would know if you were n't such a Filthy Ricefield Peasant .,['negative']
I know the author tried to find a picture that emphasize wealth/elitism but they’re toasting with water lmao,[27],ee6u0vs,1,108,18,['neutral'],know author tried find picture emphasize toasting water lmao,I know the author tried to find a picture that emphasize wealth/elitism but they ’ re toasting with water lmao,['neutral']
I guess 14 years of customer service experience is good for something after all.,[0],eddrvdz,1,80,14,['admiration'],guess 14 years customer service experience good something,I guess 14 years of customer service experience is good for something after all .,['positive']
"And losing to division rivals gives them the tie breaker, no? Very frustrating. ","[3, 9]",eds2vf9,2,80,13,"['annoyance', 'disappointment']",losing division rivals gives tie breaker frustrating,"And losing to division rivals gives them the tie breaker , no ? Very frustrating .",['negative']
"Not all men harass women, but enough of them are that all women have *been* harassed by men.",[4],efc3rlr,1,92,18,['approval'],men harass women enough women harassed men,"Not all men harass women , but enough of them are that all women have * been * harassed by men .",['positive']
You made yourself useless playing their game instead of forcing them to play to your strengths,[3],ee33ji3,1,94,16,['annoyance'],made useless playing game instead forcing play strengths,You made yourself useless playing their game instead of forcing them to play to your strengths,['negative']
"Oh, the irony,.",[26],ef9d9h9,1,15,3,['surprise'],oh irony,"Oh , the irony , .",['ambiguous']
That’s nuts about the digging. I wish we had better dog boots that fit them more naturally than what we have.,[8],ef7xk7p,1,109,21,['desire'],nuts digging wish better dog boots fit naturally,That ’ s nuts about the digging . I wish we had better dog boots that fit them more naturally than what we have .,['positive']
Yes of course and I catch a lot of it. I just didn’t realize this was about that!,"[4, 22]",edkoqqo,2,81,18,"['approval', 'realization']",yes course catch lot realize,Yes of course and I catch a lot of it . I just didn ’ t realize this was about that !,"['ambiguous', 'positive']"
Be prepared for bad news just in case,[27],efbr9wd,1,37,8,['neutral'],prepared bad news case,Be prepared for bad news just in case,['neutral']
Happy Cake Day 5makes10fm! Dare to live the life you have dreamed for yourself. Go forward and make your dreams come true.,[5],ed7ptjv,1,122,22,['caring'],happy cake day 5makes10fm dare live life dreamed go forward make dreams come true,Happy Cake Day 5makes10fm ! Dare to live the life you have dreamed for yourself . Go forward and make your dreams come true .,['positive']
"They most likely did, since they still having bank issues.",[27],ef6f9mw,1,58,10,['neutral'],likely since still bank issues,"They most likely did , since they still having bank issues .",['neutral']
">Add in reduced physician compensation and the number of doctors will go down, Where is this info?",[7],eer24d4,1,98,17,['curiosity'],add reduced physician compensation number doctors go info,"> Add in reduced physician compensation and the number of doctors will go down , Where is this info ?",['ambiguous']
Thank you for your input.,[15],eem08pm,1,25,5,['gratitude'],thank input,Thank you for your input .,['positive']
I'd be extremely motivated to take any form of martial arts lessons if they didn't cost $100 per month around where I live,"[20, 27]",ee5fn1l,2,122,23,"['optimism', 'neutral']",extremely motivated take form martial arts lessons cost 100 per month around live,I 'd be extremely motivated to take any form of martial arts lessons if they did n't cost $ 100 per month around where I live,"['neutral', 'positive']"
"Seems like that’s part 2, here is part one, full highlights from weplay",[27],ees6hqq,1,71,13,['neutral'],seems like part 2 part one full highlights weplay,"Seems like that ’ s part 2 , here is part one , full highlights from weplay",['neutral']
“Cracking himself up” nearly made me throw up.,[9],ed4g70h,1,46,8,['disappointment'],cracking nearly made throw,“ Cracking himself up ” nearly made me throw up .,['negative']
I understand why she is an ex now.,[22],eep56py,1,34,8,['realization'],understand ex,I understand why she is an ex now .,['ambiguous']
No. You know better. She has already demonstrated how little regard she has for your feelings.,[27],efbv3oe,1,94,16,['neutral'],know better already demonstrated little regard feelings,No . You know better . She has already demonstrated how little regard she has for your feelings .,['neutral']
"Sorry mate, you’ve got the wrong sub. This is for **bad** UK.",[25],edlu0w4,1,61,12,['sadness'],sorry mate got wrong sub bad uk,"Sorry mate , you ’ ve got the wrong sub . This is for * * bad * * UK .",['negative']
I guess I'm confused why beliefs are not voluntary. The link talks about conclusions based on that but doesn't seem to address the premise.,[6],eekjw1l,1,139,24,['confusion'],guess confused beliefs voluntary link talks conclusions based seem address premise,I guess I 'm confused why beliefs are not voluntary . The link talks about conclusions based on that but does n't seem to address the premise .,['ambiguous']
Thank you so much! We will likely also be doing that haha :),"[1, 15]",ef7949v,2,60,13,"['amusement', 'gratitude']",thank much likely also haha,Thank you so much ! We will likely also be doing that haha : ),['positive']
The guilt of sin represses all,[24],eenfv47,1,30,6,['remorse'],guilt sin represses,The guilt of sin represses all,['negative']
But they're this close to breaking new evidence of Russian interference!,[27],eebgsvd,1,72,11,['neutral'],close breaking new evidence russian interference,But they 're this close to breaking new evidence of Russian interference !,['neutral']
"Yes,on top of that feel like vomitting,can't breathe and thinking I will faint.",[14],eexyvx1,1,79,13,['fear'],yes top feel like vomitting ca breathe thinking faint,"Yes , on top of that feel like vomitting , ca n't breathe and thinking I will faint .",['negative']
"What a manipulative, child of a man. Jeez, grow up.",[3],ef5gppz,1,51,10,['annoyance'],manipulative child man jeez grow,"What a manipulative , child of a man . Jeez , grow up .",['negative']
Someone who seems great while texting might not be that great in person. You can't make someone meet a stranger if they don't want to.,[10],eepv7c3,1,134,25,['disapproval'],someone seems great texting might great person ca make someone meet stranger want,Someone who seems great while texting might not be that great in person . You ca n't make someone meet a stranger if they do n't want to .,['negative']
Unfortunately not.,[10],eczyxxv,1,18,2,['disapproval'],unfortunately,Unfortunately not .,['negative']
That was amazing!,[13],ee90gsc,1,17,3,['excitement'],amazing,That was amazing !,['positive']
"Wait so you can get an acre of rainforest for $35? I mean, it would be way cheaper at that volume but still that's real cheap",[26],ef1qldn,1,125,26,['surprise'],wait get acre rainforest 35 mean would way cheaper volume still real cheap,"Wait so you can get an acre of rainforest for $ 35 ? I mean , it would be way cheaper at that volume but still that 's real cheap",['ambiguous']
"I only meant it in kindness, I’ve loved this country so far. You’re all so damned friendly here",[18],eej7snu,1,95,18,['love'],meant kindness loved country far damned friendly,"I only meant it in kindness , I ’ ve loved this country so far . You ’ re all so damned friendly here",['positive']
[NAME] needs to come in now. There will be so much space for him,[27],ef223uj,1,64,14,['neutral'],name needs come much space,[ NAME ] needs to come in now . There will be so much space for him,['neutral']
My brain is exploding!,[27],edm7z6m,1,22,4,['neutral'],brain exploding,My brain is exploding !,['neutral']
Grats man. I hit my second live one today coincidentally! Feels good :),[17],ef04d6t,1,71,13,['joy'],grats man hit second live one today coincidentally feels good,Grats man . I hit my second live one today coincidentally ! Feels good : ),['positive']
Come for the [NAME]. Leave with [NAME].,[27],ee7ohto,1,39,7,['neutral'],come name leave name,Come for the [ NAME ] . Leave with [ NAME ] .,['neutral']
I want to go back in time and hug you as a child (after you got the lice treated tho).,[8],edpldme,1,86,20,['desire'],want go back time hug child got lice treated tho,I want to go back in time and hug you as a child ( after you got the lice treated tho ) .,['positive']
😡this was a scam,[2],eepxydu,1,16,4,['anger'],scam,😡this was a scam,['negative']
"Whoa, thanks for the in depth answer! ",[15],efco5i9,1,38,7,['gratitude'],whoa thanks depth answer,"Whoa , thanks for the in depth answer !",['positive']
The rest of the country is getting dicked by the cold weather meanwhile Phoenix had a low of 54 only.,[27],efd5pex,1,101,20,['neutral'],rest country getting dicked cold weather meanwhile phoenix low 54,The rest of the country is getting dicked by the cold weather meanwhile Phoenix had a low of 54 only .,['neutral']
"She is in a weird fairy tale stage, but then also realistic. I’m so confused. I guess you be both delusional and logical? ",[6],edv09fr,1,122,23,['confusion'],weird fairy tale stage also realistic confused guess delusional logical,"She is in a weird fairy tale stage , but then also realistic . I ’ m so confused . I guess you be both delusional and logical ?",['ambiguous']
"#[NAME] camp is dying, price must be dropping now that NYY are out",[27],eduoxog,1,66,13,['neutral'],name camp dying price must dropping nyy,"# [ NAME ] camp is dying , price must be dropping now that NYY are out",['neutral']
"You arent going to be making 10 million dollars in your business, this wont affect you.",[10],edkneqb,1,87,16,['disapproval'],arent going making 10 million dollars business wont affect,"You arent going to be making 10 million dollars in your business , this wont affect you .",['negative']
Likely. Just let him take every single shot all night and see what happens.,[20],ee3ha8m,1,75,14,['optimism'],likely let take every single shot night see happens,Likely . Just let him take every single shot all night and see what happens .,['positive']
too bad for [NAME] we don't negotiate with terrorists.,[27],eemg4ci,1,54,9,['neutral'],bad name negotiate terrorists,too bad for [ NAME ] we do n't negotiate with terrorists .,['neutral']
"[NAME] was our second best hitter, [NAME] was the best","[0, 4]",edrd2y2,2,54,10,"['admiration', 'approval']",name second best hitter name best,"[ NAME ] was our second best hitter , [ NAME ] was the best",['positive']
"Wow, way to deflate Endgame's stakes *even more* before the movie even comes out.","[13, 26]",ee68d2e,2,81,14,"['excitement', 'surprise']",wow way deflate endgame stakes even movie even comes,"Wow , way to deflate Endgame 's stakes * even more * before the movie even comes out .","['ambiguous', 'positive']"
Maybe we'll just stop moderating for a while to celebrate TWOW.,[17],edqfnrl,1,63,11,['joy'],maybe stop moderating celebrate twow,Maybe we 'll just stop moderating for a while to celebrate TWOW .,['positive']
"But funny, and that absolves the sin!",[1],efc8mtv,1,37,7,['amusement'],funny absolves sin,"But funny , and that absolves the sin !",['positive']
"oh no, I didn’t mean one of my boyfriends haha, I meant one of his things. we’re not in an open relationship",[1],ef2jd2r,1,108,22,['amusement'],oh mean one boyfriends haha meant one things open relationship,"oh no , I didn ’ t mean one of my boyfriends haha , I meant one of his things . we ’ re not in an open relationship",['positive']
Political affiliations has only little correlation to individual intellectual ability,[27],edm88de,1,85,10,['neutral'],political affiliations little correlation individual intellectual ability,Political affiliations has only little correlation to individual intellectual ability,['neutral']
is as good as it gets spent all morning looking for it . Thank you for your time,[15],eeiig2j,1,80,18,['gratitude'],good gets spent morning looking thank time,is as good as it gets spent all morning looking for it . Thank you for your time,['positive']
"Much less legal racism, much more corruption, crime, dysfunction, decay etc",[27],ef7vg92,1,75,11,['neutral'],much less legal racism much corruption crime dysfunction decay etc,"Much less legal racism , much more corruption , crime , dysfunction , decay etc",['neutral']
"""resistance is futile""",[27],eetyyck,1,22,3,['neutral'],resistance futile,`` resistance is futile '',['neutral']
At least you can admit you value one innocent person's life over another. What a shock it's the rich politician over the security guard.,[26],ee5pf84,1,136,24,['surprise'],least admit value one innocent person life another shock rich politician security guard,At least you can admit you value one innocent person 's life over another . What a shock it 's the rich politician over the security guard .,['ambiguous']
HAVE YOU SEEN MY SON?!,[27],ee0rebu,1,22,5,['neutral'],seen son,HAVE YOU SEEN MY SON ? !,['neutral']
Sweaty irritates me. But Its not exactly drag lingo. I've seen it on so many other subs too.,[3],ed261nh,1,92,18,['annoyance'],sweaty irritates exactly drag lingo seen many subs,Sweaty irritates me . But Its not exactly drag lingo . I 've seen it on so many other subs too .,['negative']
Thank you! It will help a lot,[15],ef0gag3,1,29,7,['gratitude'],thank help lot,Thank you ! It will help a lot,['positive']
In the comments he accuses the account of being fake and she proves her identity with photos and a link to her instagram. This guy is astoundingly pathetic.,[10],ed2ukr2,1,156,28,['disapproval'],comments accuses account fake proves identity photos link instagram guy astoundingly pathetic,In the comments he accuses the account of being fake and she proves her identity with photos and a link to her instagram . This guy is astoundingly pathetic .,['negative']
spermatozoid is wrong someone with 31Q would have bigger problems than knowing how to write sperm Did you meanS this is beatiful,[6],efdtgor,1,128,22,['confusion'],spermatozoid wrong someone 31q would bigger problems knowing write sperm means beatiful,spermatozoid is wrong someone with 31Q would have bigger problems than knowing how to write sperm Did you meanS this is beatiful,['ambiguous']
"Even if you don't act on them, you still should stay away. It's not normal to fantasize about doing sexual things to children.",[10],eeqdtde,1,126,23,['disapproval'],even act still stay away normal fantasize sexual things children,"Even if you do n't act on them , you still should stay away . It 's not normal to fantasize about doing sexual things to children .",['negative']
"As a fellow browns fan, unfortunate enough to be born into a browns family and in ohio... Hello sharer of a lifetime of heartbreak.",[25],eer7as8,1,131,24,['sadness'],fellow browns fan unfortunate enough born browns family ohio hello sharer lifetime heartbreak,"As a fellow browns fan , unfortunate enough to be born into a browns family and in ohio ... Hello sharer of a lifetime of heartbreak .",['negative']
"i had all of those. checked myself with a GP and found out i had low iron, migraines and needed to visit the therapist re my anxiety.",[14],ef89nwl,1,133,27,['fear'],checked gp found low iron migraines needed visit therapist anxiety,"i had all of those . checked myself with a GP and found out i had low iron , migraines and needed to visit the therapist re my anxiety .",['negative']
I’m in my second year. Still closeted. Still uncomfortable with my body and sexuality. Still socially awkward.,[12],edv3vmn,1,110,17,['embarrassment'],second year still closeted still uncomfortable body sexuality still socially awkward,I ’ m in my second year . Still closeted . Still uncomfortable with my body and sexuality . Still socially awkward .,['negative']
The ones that actually think he's worse than [NAME] also thinki its ok to raise their kids genderless.,[27],edw1dtu,1,102,18,['neutral'],ones actually think worse name also thinki ok raise kids genderless,The ones that actually think he 's worse than [ NAME ] also thinki its ok to raise their kids genderless .,['neutral']
Acne scars unfortunately and also out of anxiety I tend to pick at my skin.,[19],edzg5j5,1,75,15,['nervousness'],acne scars unfortunately also anxiety tend pick skin,Acne scars unfortunately and also out of anxiety I tend to pick at my skin .,['negative']
"I love the logic of a better cheaper more reliable service comes along, so let's block the roads and highways that will make people love us LOL",[1],eephfi0,1,143,27,['amusement'],love logic better cheaper reliable service comes along let block roads highways make people love us lol,"I love the logic of a better cheaper more reliable service comes along , so let 's block the roads and highways that will make people love us LOL",['positive']
**DON’T USE THESE LINKS**,[27],ee28htd,1,25,4,['neutral'],use links,* * DON ’ T USE THESE LINKS * *,['neutral']
Sorry you are having such trouble.,"[24, 25]",ed9q0u0,2,34,6,"['remorse', 'sadness']",sorry trouble,Sorry you are having such trouble .,['negative']
"The truth is, there is no spoon.",[27],edkj85d,1,32,7,['neutral'],truth spoon,"The truth is , there is no spoon .",['neutral']
So remember when everyone was reading [NAME] for making a song and performing it on the show around a contrived part of her brand???,[27],efbmrh7,1,132,24,['neutral'],remember everyone reading name making song performing show around contrived part brand,So remember when everyone was reading [ NAME ] for making a song and performing it on the show around a contrived part of her brand ? ? ?,['neutral']
