text,labels,id,num_labels,char_len,word_len,label_names,text_clean_tfidf,text_clean_transformer,grouped_labels
correct. i am the one who decides if something is funny to me or not.,"[4, 20]",eee7t3j,2,69,15,"['approval', 'optimism']",correct one decides something funny,correct . i am the one who decides if something is funny to me or not .,['positive']
"Oh whoops, I misread the original comment",[22],ed4vaif,1,41,7,['realization'],oh whoops misread original comment,"Oh whoops , I misread the original comment",['ambiguous']
"Idk why youre downvoted, executing a manequin seems fun",[1],eewt1ee,1,55,9,['amusement'],idk youre downvoted executing manequin seems fun,"Idk why youre downvoted , executing a manequin seems fun",['positive']
Old ladies are like the only ppl that are nice to me lmao. Kindered spirits with the ugly.,[1],edl4cw9,1,90,18,['amusement'],old ladies like ppl nice lmao kindered spirits ugly,Old ladies are like the only ppl that are nice to me lmao . Kindered spirits with the ugly .,['positive']
Starts hiding because he knew he was in for a lickin,[27],ee6tu6y,1,52,11,['neutral'],starts hiding knew lickin,Starts hiding because he knew he was in for a lickin,['neutral']
"Grey socks and leather sandals, that hurts me through the screen.",[25],ed7iob0,1,65,11,['sadness'],grey socks leather sandals hurts screen,"Grey socks and leather sandals , that hurts me through the screen .",['negative']
I'm so effin' proud of you! You handled it beautifully!,[0],edtdh3r,1,55,10,['admiration'],effin proud handled beautifully,I 'm so effin ' proud of you ! You handled it beautifully !,['positive']
Everybody uses your back lane. You're famous for being the local bike.,[0],ef1vqnf,1,70,12,['admiration'],everybody uses back lane famous local bike,Everybody uses your back lane . You 're famous for being the local bike .,['positive']
Fun game. Good expansion too,[0],edrx6fa,1,28,5,['admiration'],fun game good expansion,Fun game . Good expansion too,['positive']
"I stand corrected, my apologies to the mods. I'd personally like to see more banned or removed but at least they handled the most egregious.",[24],ef40dbx,1,140,25,['remorse'],stand corrected apologies mods personally like see banned removed least handled egregious,"I stand corrected , my apologies to the mods . I 'd personally like to see more banned or removed but at least they handled the most egregious .",['negative']
YESSSS!! The schtick with cameras never failed to delight.,[4],eduthmp,1,58,9,['approval'],yessss schtick cameras never failed delight,YESSSS ! ! The schtick with cameras never failed to delight .,['positive']
I'm sorry man sounds bad,[25],ee5xpc8,1,24,5,['sadness'],sorry man sounds bad,I 'm sorry man sounds bad,['negative']
"i believe he has a minor ankle injury at the moment, i’m not too worried about his skating ",[4],eddmzno,1,91,18,['approval'],believe minor ankle injury moment worried skating,"i believe he has a minor ankle injury at the moment , i ’ m not too worried about his skating",['positive']
"Unfortunately that's a long old way from Sydney, but I'm glad teams don't mind having non playing members ",[15],ef7wpji,1,106,18,['gratitude'],unfortunately long old way sydney glad teams mind non playing members,"Unfortunately that 's a long old way from Sydney , but I 'm glad teams do n't mind having non playing members",['positive']
"Kinda torn. I want us to come back, but I also want us to lose bad enough to replace [NAME] quick",[27],eeh4a1n,1,97,21,['neutral'],kinda torn want us come back also want us lose bad enough replace name quick,"Kinda torn . I want us to come back , but I also want us to lose bad enough to replace [ NAME ] quick",['neutral']
Take on me time!,[27],ee3bj1x,1,16,4,['neutral'],take time,Take on me time !,['neutral']
I think I’d take the long view - the good news is that at least she’s not pregnant...,[17],edekp81,1,85,18,['joy'],think take long view good news least pregnant,I think I ’ d take the long view - the good news is that at least she ’ s not pregnant ...,['positive']
Oh yeah. I love stepping out of the tub and putting my wet foot on COLD TILE. More like thanks I love this,[18],edebeqy,1,106,23,['love'],oh yeah love stepping tub putting wet foot cold tile like thanks love,Oh yeah . I love stepping out of the tub and putting my wet foot on COLD TILE . More like thanks I love this,['positive']
"I’m glad he’s gone from Detroit, but good on him for being a professional on ESPN. ",[0],eexp3ht,1,83,16,['admiration'],glad gone detroit good professional espn,"I ’ m glad he ’ s gone from Detroit , but good on him for being a professional on ESPN .",['positive']
cool vid! but,[0],eewukqb,1,13,3,['admiration'],cool vid,cool vid ! but,['positive']
Guess we gotta wash our clothes with some good ol Vancomycin,[27],ed5t6ei,1,60,11,['neutral'],guess got ta wash clothes good ol vancomycin,Guess we got ta wash our clothes with some good ol Vancomycin,['neutral']
"True to the first, I hope to the second.",[20],edzcvz2,1,40,9,['optimism'],true first hope second,"True to the first , I hope to the second .",['positive']
I'm a D.Va main at the moment so that one's a check chief.,[27],eda39zg,1,58,13,['neutral'],main moment one check chief,I 'm a D.Va main at the moment so that one 's a check chief .,['neutral']
"Don't worry if you're from hot, we can share my slice (:","[4, 5]",eerb1z8,2,56,12,"['approval', 'caring']",worry hot share slice,"Do n't worry if you 're from hot , we can share my slice ( :",['positive']
I see your point as well. I wasn’t the one complaining. I was supporting the one everyone was going after,[27],eelppgo,1,105,20,['neutral'],see point well one complaining supporting one everyone going,I see your point as well . I wasn ’ t the one complaining . I was supporting the one everyone was going after,['neutral']
There is no greater form of oppression than being called a bigot. #debateme #babyhitler #otherpeoplesbabies,[27],eemy7ap,1,107,15,['neutral'],greater form oppression called bigot debateme babyhitler otherpeoplesbabies,There is no greater form of oppression than being called a bigot . # debateme # babyhitler # otherpeoplesbabies,['neutral']
[NAME] has not been that impressive in my opinion. [NAME] seems like the clear-cut top guy.,"[0, 10]",edn85mv,2,91,16,"['admiration', 'disapproval']",name impressive opinion name seems like top guy,[ NAME ] has not been that impressive in my opinion . [ NAME ] seems like the clear-cut top guy .,"['negative', 'positive']"
"I’d say it’s rare, but never?",[27],ed7wwru,1,29,6,['neutral'],say rare never,"I ’ d say it ’ s rare , but never ?",['neutral']
Wauw! Those weapons are awesome!!,"[13, 26]",eefy0zd,2,33,5,"['excitement', 'surprise']",wauw weapons awesome,Wauw ! Those weapons are awesome ! !,"['ambiguous', 'positive']"
If only. He’s signing with the red wings 100%.,[27],eetlakl,1,46,9,['neutral'],signing red wings 100,If only . He ’ s signing with the red wings 100 % .,['neutral']
I’m so sorry for your loss. It’s the smallest things that take up the biggest part of our hearts.,"[24, 25]",eczy0ru,2,97,19,"['remorse', 'sadness']",sorry loss smallest things take biggest part hearts,I ’ m so sorry for your loss . It ’ s the smallest things that take up the biggest part of our hearts .,['negative']
wow even the buildings on the poster haven't loaded in,[26],ef231vk,1,54,10,['surprise'],wow even buildings poster loaded,wow even the buildings on the poster have n't loaded in,['ambiguous']
I'm so happy this post blew up because this is so true,[17],eec1oyk,1,54,12,['joy'],happy post blew true,I 'm so happy this post blew up because this is so true,['positive']
Ok guys I'll watch it. When I finish it I'll tell y'all what I think,"[4, 20]",eeq8ko1,2,68,15,"['approval', 'optimism']",ok guys watch finish tell think,Ok guys I 'll watch it . When I finish it I 'll tell y'all what I think,['positive']
"Oh definitely, there was reports of [NAME] and his supporters using Spam to spread misinformation throughout the entire campaign.",[4],eetrwsq,1,129,19,['approval'],oh definitely reports name supporters using spam spread misinformation throughout entire campaign,"Oh definitely , there was reports of [ NAME ] and his supporters using Spam to spread misinformation throughout the entire campaign .",['positive']
"Oh yeah, I forgot about the mean one.",[22],edhyt1w,1,37,8,['realization'],oh yeah forgot mean one,"Oh yeah , I forgot about the mean one .",['ambiguous']
Yea. That video is garbage.,"[11, 27]",ed0mb05,2,27,5,"['disgust', 'neutral']",yea video garbage,Yea . That video is garbage .,"['negative', 'neutral']"
"I'd love [NAME], boy can shoot",[18],eehipe5,1,30,6,['love'],love name boy shoot,"I 'd love [ NAME ] , boy can shoot",['positive']
I really try to not use that terminology as it is inconsistent and was made up by people who know little to nothing about firearms.,[27],eesqy74,1,131,25,['neutral'],really try use terminology inconsistent made people know little nothing firearms,I really try to not use that terminology as it is inconsistent and was made up by people who know little to nothing about firearms .,['neutral']
[NAME] i feel personally attacked,[25],efdh02j,1,33,5,['sadness'],name feel personally attacked,[ NAME ] i feel personally attacked,['negative']
"Nope, real serious disease affecting real people, including the person you first replied to.",[10],edmbjzj,1,92,14,['disapproval'],nope real serious disease affecting real people including person first replied,"Nope , real serious disease affecting real people , including the person you first replied to .",['negative']
"I thought it was important to celebrate a person for who they are, not who they've banged.",[27],edkdo2i,1,90,17,['neutral'],thought important celebrate person banged,"I thought it was important to celebrate a person for who they are , not who they 've banged .",['neutral']
3 hole punch rick.,[27],ee2mtyk,1,18,4,['neutral'],3 hole punch rick,3 hole punch rick .,['neutral']
Happy Cake day.,[17],ef2d740,1,15,3,['joy'],happy cake day,Happy Cake day .,['positive']
"Yes we do the want, need, wear, read thing already. Trying to get her on board with this will be like pulling teeth.",[27],ed75qqc,1,116,23,['neutral'],yes want need wear read thing already trying get board like pulling teeth,"Yes we do the want , need , wear , read thing already . Trying to get her on board with this will be like pulling teeth .",['neutral']
"I'm a doctor. The doctor examining him with severe back pain after an injury should test for sensibility, muscle strength, and reflexes at least.",[27],ed2mzlq,1,145,24,['neutral'],doctor doctor examining severe back pain injury test sensibility muscle strength reflexes least,"I 'm a doctor . The doctor examining him with severe back pain after an injury should test for sensibility , muscle strength , and reflexes at least .",['neutral']
Lol kill me now,"[1, 2]",edoeofb,2,15,4,"['amusement', 'anger']",lol kill,Lol kill me now,"['negative', 'positive']"
* No flaming or insults,[27],ed5choj,1,23,5,['neutral'],flaming insults,* No flaming or insults,['neutral']
"It's a self-identifying group, and they have killed quite a bit of people in their crusade for revenge. It's both absolutely pathetic and absolutely terrifying.",[11],ef5d6ib,1,160,25,['disgust'],group killed quite bit people crusade revenge absolutely pathetic absolutely terrifying,"It 's a self-identifying group , and they have killed quite a bit of people in their crusade for revenge . It 's both absolutely pathetic and absolutely terrifying .",['negative']
So 7 years of playing the game (started playing at 15 and is 24 now). Ridiculous.,[1],eetihm9,1,81,16,['amusement'],7 years playing game started playing 15 24 ridiculous,So 7 years of playing the game ( started playing at 15 and is 24 now ) . Ridiculous .,['positive']
Omg I used to do something similar?! Yeah I’ve worn so many hats and then just kicked them to the curb.,[12],eeua07h,1,103,21,['embarrassment'],omg used something similar yeah worn many hats kicked curb,Omg I used to do something similar ? ! Yeah I ’ ve worn so many hats and then just kicked them to the curb .,['negative']
"Send your story over to r/nice guys, they'll love it ","[4, 20]",ed8qorf,2,53,10,"['approval', 'optimism']",send story guys love,"Send your story over to r/nice guys , they 'll love it",['positive']
"Hi, [NAME]! I am stopping by to wish you the best day, and the best year! -HappyFriendlyBot",[5],ee3u66u,1,91,17,['caring'],hi name stopping wish best day best year,"Hi , [ NAME ] ! I am stopping by to wish you the best day , and the best year ! -HappyFriendlyBot",['positive']
"As a [NAME], this very relatable",[4],ef6djh1,1,32,6,['approval'],name relatable,"As a [ NAME ] , this very relatable",['positive']
I had an anourism and got stage 4 terminal cancer from reading that so I reckon that means I need the tablet,[27],effcz4d,1,108,22,['neutral'],anourism got stage 4 terminal cancer reading reckon means need tablet,I had an anourism and got stage 4 terminal cancer from reading that so I reckon that means I need the tablet,['neutral']
We just got paper straws and we have to ask everyone if they want one first. it's anoying.,[3],ef8hpis,1,90,18,['annoyance'],got paper straws ask everyone want one first anoying,We just got paper straws and we have to ask everyone if they want one first . it 's anoying .,['negative']
What are you listening to?,[7],ee92hyj,1,26,5,['curiosity'],listening,What are you listening to ?,['ambiguous']
"I can feel that already, I'm already getting pain at time with it, but I can only imagine the pain after for healing.",[25],ef7flmi,1,117,23,['sadness'],feel already already getting pain time imagine pain healing,"I can feel that already , I 'm already getting pain at time with it , but I can only imagine the pain after for healing .",['negative']
Sounds like they’re not responsible and shouldn’t have the right to have these.,"[10, 22]",efgc53r,2,79,13,"['disapproval', 'realization']",sounds like responsible right,Sounds like they ’ re not responsible and shouldn ’ t have the right to have these .,"['ambiguous', 'negative']"
"Hahaha. Oh, you.","[1, 27]",eeub69u,2,16,3,"['amusement', 'neutral']",hahaha oh,"Hahaha . Oh , you .","['neutral', 'positive']"
"Feel free to PM me, I was a longtime vegetarian before transitioning to veganism.",[4],ednz9c4,1,81,14,['approval'],feel free pm longtime vegetarian transitioning veganism,"Feel free to PM me , I was a longtime vegetarian before transitioning to veganism .",['positive']
About as serious as my plans to marry a porn star and retire to the Bahamas.,[8],edmyl35,1,76,16,['desire'],serious plans marry porn star retire bahamas,About as serious as my plans to marry a porn star and retire to the Bahamas .,['positive']
People like you are why I follow this sub. Keep it up I need more laughs like that!,[4],eebnmye,1,83,18,['approval'],people like follow sub keep need laughs like,People like you are why I follow this sub . Keep it up I need more laughs like that !,['positive']
my crush began to be annoying when i lost interest in him. it sucks either way,[3],eepvlky,1,78,16,['annoyance'],crush began annoying lost interest sucks either way,my crush began to be annoying when i lost interest in him . it sucks either way,['negative']
"no I meant, it would appear if I just walk up and have the ability, without doing anything else. ",[27],eddwhn0,1,97,19,['neutral'],meant would appear walk ability without anything else,"no I meant , it would appear if I just walk up and have the ability , without doing anything else .",['neutral']
"My daughter loves this! She's taking a bath rn singing ""fiire""",[18],ednhpsd,1,62,11,['love'],daughter loves taking bath rn singing fiire,My daughter loves this ! She 's taking a bath rn singing `` fiire '',['positive']
Weird that it wasn't included in the article.,[12],edgnvqa,1,45,8,['embarrassment'],weird included article,Weird that it was n't included in the article .,['negative']
"No car wraps? This was already upvoted a dozen times... Seriously don't understand the mods, man. ","[3, 6]",ef3pppr,2,98,16,"['annoyance', 'confusion']",car wraps already upvoted dozen times seriously understand mods man,"No car wraps ? This was already upvoted a dozen times ... Seriously do n't understand the mods , man .","['ambiguous', 'negative']"
The joke here is that [NAME] is the ‘baby.’,[27],ed5cwdg,1,43,9,['neutral'],joke name baby,The joke here is that [ NAME ] is the ‘ baby . ’,['neutral']
I didn't even think about counselors or talking to my obgyn. That's a great idea! I really appreciate the advice and encouragement :),"[0, 15]",ef2jsuc,2,133,23,"['admiration', 'gratitude']",even think counselors talking obgyn great idea really appreciate advice encouragement,I did n't even think about counselors or talking to my obgyn . That 's a great idea ! I really appreciate the advice and encouragement : ),['positive']
That guy was definitely in the process of starting a cult.,[27],edosubc,1,58,11,['neutral'],guy definitely process starting cult,That guy was definitely in the process of starting a cult .,['neutral']
Survival of the toughest.,[27],edypwz1,1,25,4,['neutral'],survival toughest,Survival of the toughest .,['neutral']
The one fucking thing my home town has contributed besides alcoholics and [NAME] and its a fucking backwards feminist horseshit theory.,[3],edoudxd,1,135,21,['annoyance'],one fucking thing home town contributed besides alcoholics name fucking backwards feminist horseshit theory,The one fucking thing my home town has contributed besides alcoholics and [ NAME ] and its a fucking backwards feminist horseshit theory .,['negative']
Very nice!! I love your art! What journal is this? I love the texture on the pages.,[0],ef7cb4h,1,83,17,['admiration'],nice love art journal love texture pages,Very nice ! ! I love your art ! What journal is this ? I love the texture on the pages .,['positive']
Love it.,[18],edqx01l,1,8,2,['love'],love,Love it .,['positive']
"I know, why publicize the accomplishments of kids that work hard",[27],edlqx16,1,64,11,['neutral'],know publicize accomplishments kids work hard,"I know , why publicize the accomplishments of kids that work hard",['neutral']
Gimmie the glove hand,[27],ef4b66m,1,21,4,['neutral'],gimmie glove hand,Gimmie the glove hand,['neutral']
[NAME] is not a guy I root against. Just hope we have a good enjoyable game,[17],ees9dg2,1,75,16,['joy'],name guy root hope good enjoyable game,[ NAME ] is not a guy I root against . Just hope we have a good enjoyable game,['positive']
This is the full-circle EP story I came here for. Made my morning. Thanks Aunt [NAME]!,[15],efd302c,1,86,16,['gratitude'],ep story came made morning thanks aunt name,This is the full-circle EP story I came here for . Made my morning . Thanks Aunt [ NAME ] !,['positive']
The Mets fans in me gets excited for [NAME] when I hear [NAME] theme.,[13],ee4q03p,1,69,14,['excitement'],mets fans gets excited name hear name theme,The Mets fans in me gets excited for [ NAME ] when I hear [ NAME ] theme .,['positive']
"This exchange made my day. From a female doc, thanks for getting it. ","[15, 17]",ef41v4r,2,69,13,"['gratitude', 'joy']",exchange made day female doc thanks getting,"This exchange made my day . From a female doc , thanks for getting it .",['positive']
Wait project players magically become great without showing any improvement who would have thought!!!,"[0, 20]",eeb0yzp,2,101,14,"['admiration', 'optimism']",wait project players magically become great without showing improvement would thought,Wait project players magically become great without showing any improvement who would have thought ! ! !,['positive']
"I am just saying in general, in any situation. Work or not. ",[27],edob9y2,1,60,12,['neutral'],saying general situation work,"I am just saying in general , in any situation . Work or not .",['neutral']
"Lost my kid to the system, wanna see wha the wee lassie has tae say","[25, 27]",edbwqxk,2,67,15,"['sadness', 'neutral']",lost kid system wan na see wha wee lassie tae say,"Lost my kid to the system , wan na see wha the wee lassie has tae say","['negative', 'neutral']"
I get it from (very Welsh) grandmotherly types at my work. Like they’re lovely but I’m 24??,[6],edoj9wx,1,91,17,['confusion'],get welsh grandmotherly types work like lovely 24,I get it from ( very Welsh ) grandmotherly types at my work . Like they ’ re lovely but I ’ m 24 ? ?,['ambiguous']
"Unfortunately you’re absolutely right, no doubt about that ",[4],ed4zcdd,1,59,8,['approval'],unfortunately absolutely right doubt,"Unfortunately you ’ re absolutely right , no doubt about that",['positive']
You're FUCKING JOKING,[1],ed9trpj,1,21,3,['amusement'],fucking joking,You 're FUCKING JOKING,['positive']
"The very best they could do was the uranium one unscandal, which even [NAME] had too much dignity to touch. ",[27],ed6a4gy,1,108,20,['neutral'],best could uranium one unscandal even name much dignity touch,"The very best they could do was the uranium one unscandal , which even [ NAME ] had too much dignity to touch .",['neutral']
This. And Dr. [NAME] told him that he was probably the heaviest person in the entire world at the time.,[27],ed800co,1,103,20,['neutral'],name told probably heaviest person entire world time,This . And Dr. [ NAME ] told him that he was probably the heaviest person in the entire world at the time .,['neutral']
"Well, it's been fun. Time to quit YT.","[1, 22]",edprdtf,2,37,8,"['amusement', 'realization']",well fun time quit yt,"Well , it 's been fun . Time to quit YT .","['ambiguous', 'positive']"
Racial attacks went up after [NAME] was elected.,[4],eev9e1h,1,48,8,['approval'],racial attacks went name elected,Racial attacks went up after [ NAME ] was elected .,['positive']
Ohhh this sounds interesting! What pod?,[7],eettpj0,1,39,6,['curiosity'],ohhh sounds interesting pod,Ohhh this sounds interesting ! What pod ?,['ambiguous']
"> The bedrock principle of representative government is that “the people” do not decide issues, they decide who shall decide. Very much this.",[4],edyu8lh,1,141,23,['approval'],bedrock principle representative government people decide issues decide shall decide much,"> The bedrock principle of representative government is that “ the people ” do not decide issues , they decide who shall decide . Very much this .",['positive']
"Shockingly, some people continue to educate and improve themselves. You might benefit from it.",[26],efd4rom,1,94,14,['surprise'],shockingly people continue educate improve might benefit,"Shockingly , some people continue to educate and improve themselves . You might benefit from it .",['ambiguous']
yeah i misread billions as millions. my bad,[9],efgqp83,1,43,8,['disappointment'],yeah misread billions millions bad,yeah i misread billions as millions . my bad,['negative']
"I’m confused because her mom doesn’t post anything bad, especially compared to her photos she took in prison. ",[6],edipxkv,1,110,18,['confusion'],confused mom post anything bad especially compared photos took prison,"I ’ m confused because her mom doesn ’ t post anything bad , especially compared to her photos she took in prison .",['ambiguous']
"Sadistic, but not smart unfortunately. ",[27],eeltjol,1,39,5,['neutral'],sadistic smart unfortunately,"Sadistic , but not smart unfortunately .",['neutral']
"Truth is, we don't know. Never tried it really.",[22],eestjzi,1,47,9,['realization'],truth know never tried really,"Truth is , we do n't know . Never tried it really .",['ambiguous']
I'm with you!!!!!!,[5],edajgmo,1,18,3,['caring'],,I 'm with you ! ! ! ! ! !,['positive']
not what his post history says,[27],edfvaq3,1,30,6,['neutral'],post history says,not what his post history says,['neutral']
That’s pretty damn good,[0],eeofkwr,1,23,4,['admiration'],pretty damn good,That ’ s pretty damn good,['positive']
I think the general consensus in this sub is that he sucks and is the worst streamer on twitch.,[27],eeymw6i,1,95,19,['neutral'],think general consensus sub sucks worst streamer twitch,I think the general consensus in this sub is that he sucks and is the worst streamer on twitch .,['neutral']
Thanks love you,"[15, 18]",eewo42n,2,15,3,"['gratitude', 'love']",thanks love,Thanks love you,['positive']
"You know, that never occurred to me! So keep cool in summer, warm in winter?","[4, 6]",eeej25d,2,76,15,"['approval', 'confusion']",know never occurred keep cool summer warm winter,"You know , that never occurred to me ! So keep cool in summer , warm in winter ?","['ambiguous', 'positive']"
"yiss they buffed [NAME], my favorite talent <3",[0],eesa4fl,1,46,8,['admiration'],yiss buffed name favorite talent 3,"yiss they buffed [ NAME ] , my favorite talent < 3",['positive']
Can we get that man checked? He knows too much.,[7],eda6b3o,1,47,10,['curiosity'],get man checked knows much,Can we get that man checked ? He knows too much .,['ambiguous']
"Thanks, and play ball!",[15],edb9itc,1,22,4,['gratitude'],thanks play ball,"Thanks , and play ball !",['positive']
I can't believe he told that story. I'm sure the minister that released the water is now so totally regretting not asking for a bj!,[26],efapeti,1,131,25,['surprise'],ca believe told story sure minister released water totally regretting asking bj,I ca n't believe he told that story . I 'm sure the minister that released the water is now so totally regretting not asking for a bj !,['ambiguous']
[NAME] in the trash that's just how I like it good list,[18],edm8u57,1,55,12,['love'],name trash like good list,[ NAME ] in the trash that 's just how I like it good list,['positive']
