text,labels,id,num_labels,char_len,word_len,label_names,text_clean_tfidf,text_clean_transformer,grouped_labels
Don't confused sex with gender. Gender identity can't be boiled down to beards and balls.,[27],eedk4ek,1,89,15,['neutral'],confused sex gender gender identity ca boiled beards balls,Do n't confused sex with gender . Gender identity ca n't be boiled down to beards and balls .,['neutral']
I’m just gonna see how tomorrow goes tbh. I’ll take life one day at a time :) thank you for the help ❤️,[15],ee2867b,1,103,23,['gratitude'],gon na see tomorrow goes tbh take life one day time thank help,I ’ m just gon na see how tomorrow goes tbh . I ’ ll take life one day at a time : ) thank you for the help ❤️,['positive']
Such is the reality of online dating for men.,[27],eemgdxd,1,45,9,['neutral'],reality online dating men,Such is the reality of online dating for men .,['neutral']
"[NAME] was struggling against the taller Sixer's guards, got swatted on a lot of drives too even with [NAME] out with injury. ",[27],edv2nlg,1,126,22,['neutral'],name struggling taller sixer guards got swatted lot drives even name injury,"[ NAME ] was struggling against the taller Sixer 's guards , got swatted on a lot of drives too even with [ NAME ] out with injury .",['neutral']
Thanks for your recommendation! My guy loves board games and those sound like they'd scratch our itches.,[15],ee7dpfz,1,104,17,['gratitude'],thanks recommendation guy loves board games sound like scratch itches,Thanks for your recommendation ! My guy loves board games and those sound like they 'd scratch our itches .,['positive']
I suppose the circumstances of it would chance things a bit :p,[20],edgmdel,1,62,12,['optimism'],suppose circumstances would chance things bit p,I suppose the circumstances of it would chance things a bit : p,['positive']
Those charts seem to indicate approximately a net 4000 advantage for [NAME] over the period considered.,[27],edlt0fq,1,103,16,['neutral'],charts seem indicate approximately net 4000 advantage name period considered,Those charts seem to indicate approximately a net 4000 advantage for [ NAME ] over the period considered .,['neutral']
If you succeed at killing yourself you can't attempt it many more times.,[27],edfib5q,1,72,13,['neutral'],succeed killing ca attempt many times,If you succeed at killing yourself you ca n't attempt it many more times .,['neutral']
"Oh, but it is.",[27],eealiau,1,14,4,['neutral'],oh,"Oh , but it is .",['neutral']
Not true at all,[10],eeka9ub,1,15,4,['disapproval'],true,Not true at all,['negative']
"They aren't horrible in the least bit. Just learn from your mistake, remember, and move on. That's all you can do.","[4, 5]",ed8v809,2,114,21,"['approval', 'caring']",horrible least bit learn mistake remember move,"They are n't horrible in the least bit . Just learn from your mistake , remember , and move on . That 's all you can do .",['positive']
My cat also thinks rugs are for pissing on.,[27],edfvvzj,1,43,9,['neutral'],cat also thinks rugs pissing,My cat also thinks rugs are for pissing on .,['neutral']
> The ball was tipped. And I haven't heard anyone criticize the offensive line for letting that happen.,[27],ee2qg7h,1,103,18,['neutral'],ball tipped heard anyone criticize offensive line letting happen,> The ball was tipped . And I have n't heard anyone criticize the offensive line for letting that happen .,['neutral']
Was Netflix ever $7.99 for HD streaming?,[7],effj83h,1,40,7,['curiosity'],netflix ever hd streaming,Was Netflix ever $ 7.99 for HD streaming ?,['ambiguous']
The real joke is your grades dude,[27],eeweozy,1,33,7,['neutral'],real joke grades dude,The real joke is your grades dude,['neutral']
I don't think aspergers causes me distress or anxiety. I think having to live in a society that privileges neurotypical modes of interaction causes me distress and anxiety,[22],edr5kc0,1,171,28,['realization'],think aspergers causes distress anxiety think live society privileges neurotypical modes interaction causes distress anxiety,I do n't think aspergers causes me distress or anxiety . I think having to live in a society that privileges neurotypical modes of interaction causes me distress and anxiety,['ambiguous']
I wonder what he's listening to...,[7],effkngl,1,34,6,['curiosity'],wonder listening,I wonder what he 's listening to ...,['ambiguous']
"Yeah, I really thought [NAME] would take his game to the next level coming here, not a big step back. Hopefully consistency will help him out. ",[20],eczmog0,1,143,26,['optimism'],yeah really thought name would take game next level coming big step back hopefully consistency help,"Yeah , I really thought [ NAME ] would take his game to the next level coming here , not a big step back . Hopefully consistency will help him out .",['positive']
"Exactly, she wasn't ""venting"", she was abusing his fiancee. ",[3],ef2dscn,1,60,9,['annoyance'],exactly venting abusing fiancee,"Exactly , she was n't `` venting '' , she was abusing his fiancee .",['negative']
Is it though? All the highschoolers I knew were too broke to be using juuls. Everyone had a suorin and the only ones with juuls were drug dealers.,"[12, 27]",efgfg8w,2,146,28,"['embarrassment', 'neutral']",though highschoolers knew broke using juuls everyone suorin ones juuls drug dealers,Is it though ? All the highschoolers I knew were too broke to be using juuls . Everyone had a suorin and the only ones with juuls were drug dealers .,"['negative', 'neutral']"
I need to amend: Fuck the Patriots and fuck [NAME] in particular.,[27],ee0mhn6,1,65,12,['neutral'],need amend fuck patriots fuck name particular,I need to amend : Fuck the Patriots and fuck [ NAME ] in particular .,['neutral']
Sorry English is not my native language. I love weed but I worry about my lungs too. What do you mean?,"[6, 18, 24]",ee1yr09,3,102,21,"['confusion', 'love', 'remorse']",sorry english native language love weed worry lungs mean,Sorry English is not my native language . I love weed but I worry about my lungs too . What do you mean ?,"['ambiguous', 'negative', 'positive']"
Do it successfully and coal country will still say it’s a stupid idea.,[3],edv6u1c,1,70,13,['annoyance'],successfully coal country still say stupid idea,Do it successfully and coal country will still say it ’ s a stupid idea .,['negative']
Pretty normal! I have a friend who is exactly the same :),[26],eel8j4o,1,57,12,['surprise'],pretty normal friend exactly,Pretty normal ! I have a friend who is exactly the same : ),['ambiguous']
"I actually rooted for you guys that Seahawks game, but now I feel the true pain. ",[25],edfofyb,1,81,16,['sadness'],actually rooted guys seahawks game feel true pain,"I actually rooted for you guys that Seahawks game , but now I feel the true pain .",['negative']
Guns == Katanas. People need to recognize this so gun obsession stops being 'cool' with virgins.,[27],edate7y,1,96,16,['neutral'],guns katanas people need recognize gun obsession stops virgins,Guns == Katanas . People need to recognize this so gun obsession stops being 'cool ' with virgins .,['neutral']
"Oh come on, can you just enjoy the damn picture?",[3],eezdq7k,1,48,10,['annoyance'],oh come enjoy damn picture,"Oh come on , can you just enjoy the damn picture ?",['negative']
Nice asimov reference,[0],ef1l2nu,1,21,3,['admiration'],nice asimov reference,Nice asimov reference,['positive']
"if we follow this pannel she is non existent and you are just allucinating, im sorry to bring the sad news ",[25],eenos5l,1,107,21,['sadness'],follow pannel non existent allucinating im sorry bring sad news,"if we follow this pannel she is non existent and you are just allucinating , im sorry to bring the sad news",['negative']
"I have the same issue. Except I'm a dude. Talking about my face. One likes me scruffy, the other baby smoothe","[4, 27]",edn6t90,2,109,21,"['approval', 'neutral']",issue except dude talking face one likes scruffy baby smoothe,"I have the same issue . Except I 'm a dude . Talking about my face . One likes me scruffy , the other baby smoothe","['neutral', 'positive']"
was it a serious injury? like bleeding on the brain? If so then it could be legit.,[7],eff8wd3,1,82,17,['curiosity'],serious injury like bleeding brain could legit,was it a serious injury ? like bleeding on the brain ? If so then it could be legit .,['ambiguous']
is it bad that i agree with this,[4],ed8dk2l,1,32,8,['approval'],bad agree,is it bad that i agree with this,['positive']
It’s too cold to go outside most of the year. Whining into webcams is all they’ve got!,[9],efawns9,1,86,17,['disappointment'],cold go outside year whining webcams got,It ’ s too cold to go outside most of the year . Whining into webcams is all they ’ ve got !,['negative']
This is turtle thing,[27],edqwp6f,1,20,4,['neutral'],turtle thing,This is turtle thing,['neutral']
"That's because real anarchism is anti-capitalist, shove a knife up your urethra nerd.",[27],eddbegw,1,85,13,['neutral'],real anarchism shove knife urethra nerd,"That 's because real anarchism is anti-capitalist , shove a knife up your urethra nerd .",['neutral']
Cars- with my dad,[27],eejs68r,1,17,4,['neutral'],dad,Cars- with my dad,['neutral']
I agree and I’m a man haha,"[1, 4]",eev6mda,2,26,7,"['amusement', 'approval']",agree man haha,I agree and I ’ m a man haha,['positive']
"The word ""YES"" has never erupted from my conciousness so fast before. I practically ejaculated it.","[4, 10]",eeakp95,2,98,16,"['approval', 'disapproval']",word yes never erupted conciousness fast practically ejaculated,The word `` YES '' has never erupted from my conciousness so fast before . I practically ejaculated it .,"['negative', 'positive']"
"> pro peace. Somehow pro-peace became pro-Putin. Yes, people have lost their minds.",[27],edv3rcn,1,83,13,['neutral'],pro peace somehow became yes people lost minds,"> pro peace . Somehow pro-peace became pro-Putin . Yes , people have lost their minds .",['neutral']
As quick as possible? I wish. 2 hours and 9 minutes I will never get back,[8],eewvlcy,1,73,16,['desire'],quick possible wish 2 hours 9 minutes never get back,As quick as possible ? I wish . 2 hours and 9 minutes I will never get back,['positive']
My favorite pairing now is [NAME] and [NAME]. There's nothing else good. Of course I Like [NAME] and [NAME] too but I miss [NAME] so much,[27],eemc2ti,1,137,26,['neutral'],favorite pairing name name nothing else good course like name name miss name much,My favorite pairing now is [ NAME ] and [ NAME ] . There 's nothing else good . Of course I Like [ NAME ] and [ NAME ] too but I miss [ NAME ] so much,['neutral']
[NAME] has personal experience with people turning into remorseless killers. What he thinks of walkers is immaterial.,[27],eeftwn4,1,117,17,['neutral'],name personal experience people turning remorseless killers thinks walkers immaterial,[ NAME ] has personal experience with people turning into remorseless killers . What he thinks of walkers is immaterial .,['neutral']
FUCKACTIVISION THEY RUIN EVERYTHING,"[2, 9]",ef9ikhk,2,35,4,"['anger', 'disappointment']",fuckactivision ruin everything,FUCKACTIVISION THEY RUIN EVERYTHING,['negative']
lol at them both getting downvotes,[1],edm5ljm,1,34,6,['amusement'],lol getting downvotes,lol at them both getting downvotes,['positive']
I'd almost rather a criminal have a gun than this guy.,[27],ee1ka2g,1,54,11,['neutral'],almost rather criminal gun guy,I 'd almost rather a criminal have a gun than this guy .,['neutral']
Oh dear - I can spot a problem with this...,[27],edjyyj7,1,43,10,['neutral'],oh dear spot problem,Oh dear - I can spot a problem with this ...,['neutral']
"Actually made me feel worse. Kids are always back there, death would have been guaranteed had they any.",[25],ee3mres,1,103,18,['sadness'],actually made feel worse kids always back death would guaranteed,"Actually made me feel worse . Kids are always back there , death would have been guaranteed had they any .",['negative']
Appreciate the honesty though,"[4, 27]",eeqqoq5,2,29,4,"['approval', 'neutral']",appreciate honesty though,Appreciate the honesty though,"['neutral', 'positive']"
Now this I like.,"[17, 18]",ee210a6,2,16,4,"['joy', 'love']",like,Now this I like .,['positive']
This is why I clean my belly button every day. That’s disgusting,[11],edbj8al,1,64,12,['disgust'],clean belly button every day disgusting,This is why I clean my belly button every day . That ’ s disgusting,['negative']
Pulisic is a replacement for our abysmal right wing.,[27],edl0b3x,1,52,9,['neutral'],pulisic replacement abysmal right wing,Pulisic is a replacement for our abysmal right wing .,['neutral']
"Nah we love telling people to post hog, you're just making our day better.",[10],ed3s1qi,1,74,14,['disapproval'],nah love telling people post hog making day better,"Nah we love telling people to post hog , you 're just making our day better .",['negative']
At least they got the ball back after the BS PI that was called. We just had to take it gave them kick the GW FG.,[27],een3h1l,1,113,26,['neutral'],least got ball back bs pi called take gave kick gw fg,At least they got the ball back after the BS PI that was called . We just had to take it gave them kick the GW FG .,['neutral']
I like [NAME] :(,[18],ed6qbga,1,16,4,['love'],like name,I like [ NAME ] : (,['positive']
It's time to fertilize the lawns. A couple of 500lb bags should do!,[27],efg80hn,1,67,13,['neutral'],time fertilize lawns couple 500lb bags,It 's time to fertilize the lawns . A couple of 500lb bags should do !,['neutral']
"Well, that's just a distraction for the color of your resume.",[27],eecqmza,1,61,11,['neutral'],well distraction color resume,"Well , that 's just a distraction for the color of your resume .",['neutral']
Beautiful!!! I always accidentally miss the 45 S exit at this location.,[0],ed27pnf,1,71,12,['admiration'],beautiful always accidentally miss 45 exit location,Beautiful ! ! ! I always accidentally miss the 45 S exit at this location .,['positive']
Was thinking this would go the route of actually eating the thin guy. Bravo. 👏👏,"[0, 20]",edxpu1u,2,79,15,"['admiration', 'optimism']",thinking would go route actually eating thin guy bravo,Was thinking this would go the route of actually eating the thin guy . Bravo . 👏👏,['positive']
I couldn't think of a better definition.,[27],ee5j5c1,1,40,7,['neutral'],could think better definition,I could n't think of a better definition .,['neutral']
"The details on this building are fantastic. If anyone gets a chance to see it up close, you definitely should.",[0],ed9yhmc,1,110,20,['admiration'],details building fantastic anyone gets chance see close definitely,"The details on this building are fantastic . If anyone gets a chance to see it up close , you definitely should .",['positive']
Fuck gateway pundit but it’s not a hoax,[27],edr8zt6,1,39,8,['neutral'],fuck gateway pundit hoax,Fuck gateway pundit but it ’ s not a hoax,['neutral']
You don't need financial management when the government handles all your money and all your legal representation is also provided by all mighty government.,[27],edllrs3,1,155,24,['neutral'],need financial management government handles money legal representation also provided mighty government,You do n't need financial management when the government handles all your money and all your legal representation is also provided by all mighty government .,['neutral']
"You see benevolent, I see cynical and morally bankrupt.",[27],eenp4pd,1,55,9,['neutral'],see benevolent see cynical morally bankrupt,"You see benevolent , I see cynical and morally bankrupt .",['neutral']
You really think the Senate and then [NAME] will sign this lmao?,[1],edcaznm,1,64,12,['amusement'],really think senate name sign lmao,You really think the Senate and then [ NAME ] will sign this lmao ?,['positive']
They were talking about what they should call the 'not Constantinople' release in the meeting- its a crime that nobody thought of this.,[10],eeedrev,1,135,23,['disapproval'],talking call constantinople release crime nobody thought,They were talking about what they should call the 'not Constantinople ' release in the meeting- its a crime that nobody thought of this .,['negative']
No bullet dodged this was a traumatic event that will follow this poor thing around the rest of her life.,[27],eesci8t,1,105,20,['neutral'],bullet dodged traumatic event follow poor thing around rest life,No bullet dodged this was a traumatic event that will follow this poor thing around the rest of her life .,['neutral']
one of us ... I do that too,[27],ed92yo6,1,27,8,['neutral'],one us,one of us ... I do that too,['neutral']
You need HELP!,[5],eehz01l,1,14,3,['caring'],need help,You need HELP !,['positive']
5 make the football hall a year as players. It’s a huge event when we get the rare 4 man induction in MLB,[27],ed5q4pd,1,105,23,['neutral'],5 make football hall year players huge event get rare 4 man induction mlb,5 make the football hall a year as players . It ’ s a huge event when we get the rare 4 man induction in MLB,['neutral']
I would like a hug,"[8, 18]",ef0bcca,2,18,5,"['desire', 'love']",would like hug,I would like a hug,['positive']
"Wait, so you really can't carry bags to school in US? ",[27],edcdj5t,1,54,11,['neutral'],wait really ca carry bags school us,"Wait , so you really ca n't carry bags to school in US ?",['neutral']
I love your writing style!,[18],ef3kzmt,1,26,5,['love'],love writing style,I love your writing style !,['positive']
That was such awful bandaid application. Like what the fuck.,[3],ed0booe,1,60,10,['annoyance'],awful bandaid application like fuck,That was such awful bandaid application . Like what the fuck .,['negative']
Think about it as a normal match then be confident in your play.,[27],eevdgw5,1,64,13,['neutral'],think normal match confident play,Think about it as a normal match then be confident in your play .,['neutral']
This is peak level of marketing inception. When people promote your movie by admiring your promotion of the movie.,"[0, 27]",ed3bz35,2,114,19,"['admiration', 'neutral']",peak level marketing inception people promote movie admiring promotion movie,This is peak level of marketing inception . When people promote your movie by admiring your promotion of the movie .,"['neutral', 'positive']"
I already did,"[4, 27]",edkv251,2,13,3,"['approval', 'neutral']",already,I already did,"['neutral', 'positive']"
It's like [NAME] *Avatar: The Last Airbender*. He had some great source material but utterly botched the execution.,[27],ef14lca,1,115,18,['neutral'],like name avatar last airbender great source material utterly botched execution,It 's like [ NAME ] * Avatar : The Last Airbender * . He had some great source material but utterly botched the execution .,['neutral']
"[NAME] is a turd, but I actually believe him here. I'd be stunned if he didn't have a bigger offer than what [NAME] reported.",[27],ee84mpq,1,125,24,['neutral'],name turd actually believe stunned bigger offer name reported,"[ NAME ] is a turd , but I actually believe him here . I 'd be stunned if he did n't have a bigger offer than what [ NAME ] reported .",['neutral']
Of course. Just know that I know that you know you're a liar.,[2],ef882m1,1,61,13,['anger'],course know know know liar,Of course . Just know that I know that you know you 're a liar .,['negative']
This looks more like 1954.,[4],edjnega,1,26,5,['approval'],looks like 1954,This looks more like 1954 .,['positive']
I can barely remember when it was even possible to find shit that horrible,[2],efew5jw,1,74,14,['anger'],barely remember even possible find shit horrible,I can barely remember when it was even possible to find shit that horrible,['negative']
"I have a solid plan in place, definitely not an impulse decision. Just curious about other people’s experiences. ","[4, 7]",edw4840,2,113,18,"['approval', 'curiosity']",solid plan place definitely impulse decision curious people experiences,"I have a solid plan in place , definitely not an impulse decision . Just curious about other people ’ s experiences .","['ambiguous', 'positive']"
I wish [NAME] made the levels up to 100.,[8],edcoaee,1,40,9,['desire'],wish name made levels 100,I wish [ NAME ] made the levels up to 100 .,['positive']
what an idiot,[2],ed6pccv,1,13,3,['anger'],idiot,what an idiot,['negative']
"[NAME], Big Bang Theory is terrible so glad it's going to be gone.",[23],eek7x6k,1,66,13,['relief'],name big bang theory terrible glad going gone,"[ NAME ] , Big Bang Theory is terrible so glad it 's going to be gone .",['positive']
So basically the greatest person on earth.,[0],ee6871i,1,42,7,['admiration'],basically greatest person earth,So basically the greatest person on earth .,['positive']
No. I want to know why the law applies differently to her and how I can use that to my advantage,[7],eewhj5b,1,96,21,['curiosity'],want know law applies differently use advantage,No . I want to know why the law applies differently to her and how I can use that to my advantage,['ambiguous']
I heard your dad went into a restaurant and ate all the food in the restaurant and they had to close the restaurant.,[27],eeqilwv,1,116,23,['neutral'],heard dad went restaurant ate food restaurant close restaurant,I heard your dad went into a restaurant and ate all the food in the restaurant and they had to close the restaurant .,['neutral']
"In the back of my car, for reasons we can’t find a safe bed to go to",[27],eeu8p1c,1,68,17,['neutral'],back car reasons find safe bed go,"In the back of my car , for reasons we can ’ t find a safe bed to go to",['neutral']
"By all means, tell me what I said that was incorrect. ",[27],edqsuiy,1,54,11,['neutral'],means tell said incorrect,"By all means , tell me what I said that was incorrect .",['neutral']
"But the battle dynamics are sh*t. Every other ME is better in that respect, especially the squad AI is bad. Really bad.",[11],edcdbo8,1,119,22,['disgust'],battle dynamics sh every better respect especially squad ai bad really bad,"But the battle dynamics are sh * t. Every other ME is better in that respect , especially the squad AI is bad . Really bad .",['negative']
I've never decided to have just one late night drunk egg,[10],edq93my,1,56,11,['disapproval'],never decided one late night drunk egg,I 've never decided to have just one late night drunk egg,['negative']
Sick of that stupid floss dance,[3],eezs615,1,31,6,['annoyance'],sick stupid floss dance,Sick of that stupid floss dance,['negative']
Thank god. I thought he double jumped.,[15],ed5ikd2,1,38,7,['gratitude'],thank god thought double jumped,Thank god . I thought he double jumped .,['positive']
[NAME] missed it solely because they've moved from the Rookies vs Sophomores format.,[9],efbhr9e,1,84,13,['disappointment'],name missed solely moved rookies vs sophomores format,[ NAME ] missed it solely because they 've moved from the Rookies vs Sophomores format .,['negative']
"Interesting, but I can't imagine it will be there long until someone steals or destroys it.",[7],ee5cpks,1,91,16,['curiosity'],interesting ca imagine long someone steals destroys,"Interesting , but I ca n't imagine it will be there long until someone steals or destroys it .",['ambiguous']
"You know what you’re right, not with risking my CC info. Good thing I was too lazy to do it right away. ","[0, 22]",efcml3z,2,104,22,"['admiration', 'realization']",know right risking cc info good thing lazy right away,"You know what you ’ re right , not with risking my CC info . Good thing I was too lazy to do it right away .","['ambiguous', 'positive']"
Keeping the stomach warm also helps. Holding the baby with their stomach against yours helps them fall asleep. But it doesn't work all the time unfortunately.,[5],ed2rfl3,1,158,26,['caring'],keeping stomach warm also helps holding baby stomach helps fall asleep work time unfortunately,Keeping the stomach warm also helps . Holding the baby with their stomach against yours helps them fall asleep . But it does n't work all the time unfortunately .,['positive']
Utah grubs This is a great place for restaurant recommendations.,[27],edwajgk,1,64,10,['neutral'],utah grubs great place restaurant recommendations,Utah grubs This is a great place for restaurant recommendations .,['neutral']
Oh. Great,[0],eewbkvs,1,9,2,['admiration'],oh great,Oh . Great,['positive']
"Just got back from TWC, and they were great! Thank you. 90% they were fried. Will try these others next ","[0, 15]",eeeybmj,2,104,20,"['admiration', 'gratitude']",got back twc great thank 90 fried try others next,"Just got back from TWC , and they were great ! Thank you . 90 % they were fried . Will try these others next",['positive']
For me it is easier to believe that the Big Bang occurred via a natural process than through an external agent such as some god.,[4],ed0g6a1,1,128,25,['approval'],easier believe big bang occurred via natural process external agent god,For me it is easier to believe that the Big Bang occurred via a natural process than through an external agent such as some god .,['positive']
"I love it, made me smile. Glad he is helping out animal friends!",[18],eedcrxd,1,64,13,['love'],love made smile glad helping animal friends,"I love it , made me smile . Glad he is helping out animal friends !",['positive']
But balance does not include the dark side,[10],ed4ykdw,1,42,8,['disapproval'],balance include dark side,But balance does not include the dark side,['negative']
I'm a PR and I've been lucky enough to have millions in capital and that is ALL the statue states.,[15],edv15p7,1,98,20,['gratitude'],pr lucky enough millions capital statue states,I 'm a PR and I 've been lucky enough to have millions in capital and that is ALL the statue states .,['positive']
How right you are.,[27],eeenwax,1,18,4,['neutral'],right,How right you are .,['neutral']
